"https://vintagefrenchart.com/boutique/page/3/","text/html; charset=UTF-8","200","OK","Indexable","","Boutique 3 | Vintage French Art","31","277","","0","0","Explorez notre boutique d'art vintage français. Affiches, illustrations et œuvres originales soigneusement sélectionnées. Pièces uniques et authentiques pour décorer votre intérieur.","182","1105","","0","","0","","0","Brocante en ligne d’objets vintage rares et authentiques","56","Camille Tharaud vase Art Déco en porcelaine de Limoges","54","index, follow, max-snippet:-1, max-image-preview:large, max-video-preview:-1","","","","https://vintagefrenchart.com/boutique/page/3/","https://vintagefrenchart.com/boutique/page/4/","https://vintagefrenchart.com/boutique/page/2/","","","","383031","71530","71530","27,402","","852","154","5,532","75,313","Assez facile","1,590","2","3","","11","5","0","4,000","125","62","0","7","6","0","","","","","ac0412ddb70f9e99535c77a14bc4af9c","1,103","Thu, 05 Mar 2026 18:56:51 GMT","","","","fr-FR","1.1","","","","","","https://vintagefrenchart.com/boutique/page/3/","2026-03-05 19:56:52"
"https://vintagefrenchart.com/boutique/page/4/","text/html; charset=UTF-8","200","OK","Indexable","","Boutique 4 | Vintage French Art","31","277","","0","0","Explorez notre boutique d'art vintage français. Affiches, illustrations et œuvres originales soigneusement sélectionnées. Pièces uniques et authentiques pour décorer votre intérieur.","182","1105","","0","","0","","0","Brocante en ligne d’objets vintage rares et authentiques","56","Guéridon vintage et table d’appoint | design scandinave | année 60","66","index, follow, max-snippet:-1, max-image-preview:large, max-video-preview:-1","","","","https://vintagefrenchart.com/boutique/page/4/","https://vintagefrenchart.com/boutique/page/5/","https://vintagefrenchart.com/boutique/page/3/","","","","383946","72601","72601","27,812","","863","155","5,568","76,980","Assez facile","1,589","2","3","","11","5","0","4,000","125","61","0","7","6","0","","","","","94bb0c6f061b6006f4f8bd311dc60e67","1,543","Thu, 05 Mar 2026 18:56:51 GMT","","","","fr-FR","1.1","","","","","","https://vintagefrenchart.com/boutique/page/4/","2026-03-05 19:56:51"
"https://vintagefrenchart.com/produit/plaque-emaillee-nestle-creme-de-gruyere/","text/html; charset=UTF-8","200","OK","Indexable","","Plaque émaillée Nestlé Crème de Gruyère | Collection vintage","60","549","","0","0","Plaque émaillée Nestlé Crème de Gruyère authentique. Publicité vintage alimentaire de collection. Objet décoratif rétro recherché.","130","790","","0","Plaque émaillée Nestlé crème de gruyère","39","","0","Plaque émaillée Nestlé crème de gruyère entièrement d’origine aucune restauration.","82","Produits similaires","19","index, follow, max-snippet:-1, max-image-preview:large, max-video-preview:-1","","","","https://vintagefrenchart.com/produit/plaque-emaillee-nestle-creme-de-gruyere/","","","","","","291624","65604","65604","25,132","","550","104","5,288","73,490","Assez facile","1,494","2","2","","22","9","0","7,200","65","31","0","7","6","0","","","","","b9dd8e08ba19e7f9564d54299867f787","0,098","Thu, 05 Mar 2026 09:20:32 GMT","","","","fr-FR","1.1","","","","","","https://vintagefrenchart.com/produit/plaque-emaillee-nestle-creme-de-gruyere/","2026-03-05 19:56:54"
"https://vintagefrenchart.com/produit/plaque-ancienne-publicitaire-berrogaz/","text/html; charset=UTF-8","200","OK","Indexable","","Plaque publicitaire ancienne Berrogaz | Objet de collection","59","518","","0","0","Plaque ancienne publicitaire Berrogaz en état d'origine. Décoration vintage authentique pour collectionneurs avertis.","117","714","","0","BERROGAZ : Plaque ancienne publicitaire","39","","0","BERROGAZ : Plaque ancienne publicitaire","39","Descriptif détaillé de la plaque ancienne Berrogaz","50","index, follow, max-snippet:-1, max-image-preview:large, max-video-preview:-1","","","","https://vintagefrenchart.com/produit/plaque-ancienne-publicitaire-berrogaz/","","","","","","303587","66646","66646","25,531","","521","111","4,694","67,945","Normal","1,378","2","2","","26","11","0","8,800","64","30","0","7","6","0","","","","","eea552e19ddcf9d5f94c8b6d95eaf89a","0,164","Thu, 05 Mar 2026 09:08:09 GMT","","","","fr-FR","1.1","","","","","","https://vintagefrenchart.com/produit/plaque-ancienne-publicitaire-berrogaz/","2026-03-05 19:56:54"
"https://vintagefrenchart.com/produit/fauteuils-borsani-osvaldo/","text/html; charset=UTF-8","200","OK","Indexable","","Fauteuils Borsani Osvaldo vintage 70 | Design bureau italien","60","532","","0","0","Fauteuils de bureau vintage années 70 par Borsani Osvaldo. Design italien de collection. Mobilier professionnel rétro.","118","716","","0","Fauteuils de bureau vintage 70′ par BORSANI OSVALDO","51","","0","Osvaldo Borsani (1911-1985)","27","Produits similaires","19","index, follow, max-snippet:-1, max-image-preview:large, max-video-preview:-1","","","","https://vintagefrenchart.com/produit/fauteuils-borsani-osvaldo/","","","","","","277895","66299","66299","25,398","","780","127","6,142","68,820","Normal","2,060","2","2","","16","6","0","4,800","56","28","0","7","6","0","","","","","bcca1c7917f9cc31779f0614e00263e8","0,249","Thu, 05 Mar 2026 09:20:40 GMT","","","","fr-FR","1.1","","","","","","https://vintagefrenchart.com/produit/fauteuils-borsani-osvaldo/","2026-03-05 19:57:00"
"https://vintagefrenchart.com/produit/lot-chaise-design-mobilor-herbst/","text/html; charset=UTF-8","200","OK","Indexable","","Chaises Design René Herbst par Mobilor | Lot de 5 vintage","57","516","","0","0","Lot de 5 chaises design René Herbst par Mobilor. Mobilier vintage moderniste de collection. Métal et bois.","106","645","","0","Lot de 5 Chaises Design René HERBST par Mobilor","47","","0","Produits similaires","19","Fauteuils de bureau vintage 70′ par BORSANI OSVALDO","51","index, follow, max-snippet:-1, max-image-preview:large, max-video-preview:-1","","","","https://vintagefrenchart.com/produit/lot-chaise-design-mobilor-herbst/","","","","","","265951","64127","64127","24,566","","408","74","5,514","62,312","Normal","1,318","2","2","","19","6","0","4,800","55","29","0","7","6","0","","","","","e2d95fdf71a305a3195e4cb687f7ec8","0,335","Thu, 05 Mar 2026 09:20:29 GMT","","","","fr-FR","1.1","","","","","","https://vintagefrenchart.com/produit/lot-chaise-design-mobilor-herbst/","2026-03-05 19:57:00"
"https://vintagefrenchart.com/produit/chaise-scandinave-fanett/","text/html; charset=UTF-8","200","OK","Indexable","","Chaises scandinaves Fanett Ilmari Tapiovaara | Design finlandais","64","579","","0","0","Chaises scandinaves Fanett par Ilmari Tapiovaara. Design finlandais vintage de collection. Mobilier mid-century authentique.","124","767","","0","Chaises scandinaves Fanett d’Ilmari Tapiovaara","46","","0","Belles chaises Scandinaves modèle Fanett D’Ilmari Tapiovaara","60","Produits similaires","19","index, follow, max-snippet:-1, max-image-preview:large, max-video-preview:-1","","","","https://vintagefrenchart.com/produit/chaise-scandinave-fanett/","","","","","","277233","66306","66306","25,401","","614","114","5,386","63,583","Normal","1,725","2","2","","16","6","0","4,800","56","28","0","7","6","0","","","","","718263fb7071fa64f9f55c89e0efa3bc","0,391","Thu, 05 Mar 2026 09:20:43 GMT","","","","fr-FR","1.1","","","","","","https://vintagefrenchart.com/produit/chaise-scandinave-fanett/","2026-03-05 19:57:00"
"https://vintagefrenchart.com/produit/sculpture-buste-terre-cuite-hauchecorne/","text/html; charset=UTF-8","200","OK","Indexable","","Sculpture buste terre cuite Hauchecorne | Art signé","51","455","","0","0","Sculpture buste en terre cuite signée G. Hauchecorne. Art français de collection. Pièce originale d'atelier.","108","637","","0","G. Hauchecorne : Sculpture buste terre cuite signé","50","","0","Sculpture buste terre cuite signé G. Hauchecorne","48","Gaston Hauchecorne","18","index, follow, max-snippet:-1, max-image-preview:large, max-video-preview:-1","","","","https://vintagefrenchart.com/produit/sculpture-buste-terre-cuite-hauchecorne/","","","","","","303365","67491","67491","25,855","","559","116","4,819","76,179","Assez facile","1,425","2","2","","20","8","0","6,400","65","31","0","7","6","0","","","","","807f0593c9ce9f54609cf9a0d15141b","0,203","Thu, 05 Mar 2026 09:24:01 GMT","","","","fr-FR","1.1","","","","","","https://vintagefrenchart.com/produit/sculpture-buste-terre-cuite-hauchecorne/","2026-03-05 19:57:01"
"https://vintagefrenchart.com/produit/canif-couteau-de-poche-jean-jaures/","text/html; charset=UTF-8","200","OK","Indexable","","Canif Jean Jaurès couteau de poche | Collection politique","57","511","","0","0","Canif couteau de poche Jean Jaurès de collection. Objet politique vintage rare. Pièce historique française authentique.","119","727","","0","Canif couteau de poche | Jean JAURES","36","","0","Couteau de poche « Jean JAURES »","32","Produits similaires","19","index, follow, max-snippet:-1, max-image-preview:large, max-video-preview:-1","","","","https://vintagefrenchart.com/produit/canif-couteau-de-poche-jean-jaures/","","","","","","299193","66582","66582","25,506","","522","98","5,327","72,746","Assez facile","1,357","2","2","","20","6","0","4,800","65","30","0","7","6","0","","","","","2852c66daa6540f78baf822e339bde7","0,171","Thu, 05 Mar 2026 09:24:08 GMT","","","","fr-FR","1.1","","","","","","https://vintagefrenchart.com/produit/canif-couteau-de-poche-jean-jaures/","2026-03-05 19:57:01"
"https://vintagefrenchart.com/produit/vase-verre-emaille-mary-gregory/","text/html; charset=UTF-8","200","OK","Indexable","","Vase Mary Gregory verre émaillé XIXème | Antiquité verrerie","59","537","","0","0","Vase en verre émaillé XIXème siècle de Mary Gregory. Antiquité verrerie de collection. Décor enfantin caractéristique.","118","713","","0","Vase verre émaillé XIXème siècle de Mary Gregory","48","","0","Elégant vase verre émaillé Mary Gregory – Epoque XIXème siècle","62","Descriptif détaillée","20","index, follow, max-snippet:-1, max-image-preview:large, max-video-preview:-1","","","","https://vintagefrenchart.com/produit/vase-verre-emaille-mary-gregory/","","","","","","299661","66119","66119","25,329","","523","99","5,283","70,448","Assez facile","1,379","2","2","","29","9","0","7,200","63","31","0","7","6","0","","","","","e294758abbb3430f146c5098717e4865","0,211","Thu, 05 Mar 2026 09:11:31 GMT","","","","fr-FR","1.1","","","","","","https://vintagefrenchart.com/produit/vase-verre-emaille-mary-gregory/","2026-03-05 19:57:01"
"https://vintagefrenchart.com/produit/coupe-1900-edouard-stellmacher/","text/html; charset=UTF-8","200","OK","Indexable","","Coupe 1900 Edouard Stellmacher | Art Nouveau céramique","54","523","","0","0","Coupe Art Nouveau 1900 par Edouard Stellmacher. Céramique de collection autrichienne. Pièce signée d'exception.","111","706","","0","Coupe 1900 Edouard STELLMACHER","30","","0","Edouard STELLMACHER : Coupe Art Nouveau","39","Eduard STELLMACHER (1868-1945)","30","index, follow, max-snippet:-1, max-image-preview:large, max-video-preview:-1","","","","https://vintagefrenchart.com/produit/coupe-1900-edouard-stellmacher/","","","","","","309463","67531","67531","25,870","","602","117","5,145","74,713","Assez facile","1,481","2","2","","18","7","0","5,600","64","31","0","7","6","0","","","","","459fada9cf7150da6cb69407c4d9deaf","0,098","Thu, 05 Mar 2026 09:24:11 GMT","","","","fr-FR","1.1","","","","","","https://vintagefrenchart.com/produit/coupe-1900-edouard-stellmacher/","2026-03-05 19:57:02"
"https://vintagefrenchart.com/produit/vase-verre-emaille-bleu-cobalt-epoque-xixeme/","text/html; charset=UTF-8","200","OK","Indexable","","Vase verre émaillé bleu cobalt XIXème | Antiquité française","59","530","","0","0","Vase en verre émaillé bleu cobalt du XIXème siècle. Antiquité française de collection. Décor floral peint à la main.","116","686","","0","Vase verre émaillé bleu cobalt – Epoque XIXème","46","","0","Elégant vase verre émaillé bleu cobalt – Epoque XIXème","54","Produits similaires","19","index, follow, max-snippet:-1, max-image-preview:large, max-video-preview:-1","","","","https://vintagefrenchart.com/produit/vase-verre-emaille-bleu-cobalt-epoque-xixeme/","","","","","","300105","66139","66139","25,337","","491","94","5,223","72,652","Assez facile","1,298","2","2","","29","9","0","7,200","64","32","0","7","6","0","","","","","a524ae2572d350cb86fc6a16be45ec59","0,126","Thu, 05 Mar 2026 09:07:06 GMT","","","","fr-FR","1.1","","","","","","https://vintagefrenchart.com/produit/vase-verre-emaille-bleu-cobalt-epoque-xixeme/","2026-03-05 19:57:02"
"https://vintagefrenchart.com/produit/serre-livres-art-deco-1930/","text/html; charset=UTF-8","200","OK","Indexable","","Serre-livres Art Déco 1930 | Objet de collection vintage","56","485","","0","0","Serre-livres Art Déco des années 1930. Objet de collection vintage pour bureau ou bibliothèque. Décoration authentique.","119","735","","0","Serre livres Art Déco 1930","26","","0","Paire de serre livres Art Déco 1930","35","Descriptif détaillé de la paire de serre livres Art Déco","56","index, follow, max-snippet:-1, max-image-preview:large, max-video-preview:-1","","","","https://vintagefrenchart.com/produit/serre-livres-art-deco-1930/","","","","","","307883","67167","67167","25,730","","540","109","4,954","78,197","Assez facile","1,329","2","2","","20","8","0","6,400","63","31","0","7","6","0","","","","","edf68ffb309bd3fb679aa7207dd36295","0,380","Thu, 05 Mar 2026 09:11:17 GMT","","","","fr-FR","1.1","","","","","","https://vintagefrenchart.com/produit/serre-livres-art-deco-1930/","2026-03-05 19:57:01"
"https://vintagefrenchart.com/produit/camille-tharaud-vase-art-deco-porcelaine-de-limoges/","text/html; charset=UTF-8","200","OK","Indexable","","Vase Art Déco Camille Tharaud porcelaine Limoges | Signé","56","524","","0","0","Vase Art Déco par Camille Tharaud en porcelaine de Limoges. Pièce signée de collection. Céramique française d'exception.","120","749","","0","Camille Tharaud vase Art Déco en porcelaine de Limoges","54","","0","Vase Art Déco en porcelaine de Limoges signé par Camille Tharaud (1878-1956)","76","Descriptif détaillé","19","index, follow, max-snippet:-1, max-image-preview:large, max-video-preview:-1","","","","https://vintagefrenchart.com/produit/camille-tharaud-vase-art-deco-porcelaine-de-limoges/","","","","","","294961","66416","66416","25,443","","696","139","5,007","73,880","Assez facile","1,751","2","2","","35","11","0","8,800","64","31","0","7","6","0","","","","","a63cac134cab53d8efe61bee02c126b7","0,099","Thu, 05 Mar 2026 09:28:02 GMT","","","","fr-FR","1.1","","","","","","https://vintagefrenchart.com/produit/camille-tharaud-vase-art-deco-porcelaine-de-limoges/","2026-03-05 19:57:02"
"https://vintagefrenchart.com/produit/cendrier-jacques-adnet/","text/html; charset=UTF-8","200","OK","Indexable","","Cendrier sur pied Jacques Adnet | Design français vintage","57","514","","0","0","Cendrier sur pied par Jacques Adnet. Design français vintage de collection. Objet décoratif moderniste authentique.","115","710","","0","Cendrier sur pied Jacques Adnet","31","","0","Cendrier sur pied attribué à Jacques Adnet.","43","DESIGNER – Jacques Adnet","24","index, follow, max-snippet:-1, max-image-preview:large, max-video-preview:-1","","","","https://vintagefrenchart.com/produit/cendrier-jacques-adnet/","","","","","","293005","66359","66359","25,421","","654","116","5,638","72,790","Assez facile","1,664","2","2","","29","9","0","7,200","64","32","0","7","6","0","","","","","4cff65843d9d2be5a9eccab87809fa36","0,110","Thu, 05 Mar 2026 09:20:38 GMT","","","","fr-FR","1.1","","","","","","https://vintagefrenchart.com/produit/cendrier-jacques-adnet/","2026-03-05 19:57:02"
"https://vintagefrenchart.com/my-account/lost-password/","text/html; charset=UTF-8","200","OK","Non indexable","noindex","My account | Vintage French Art","31","284","","0","0","","0","0","","0","My account","10","","0","","0","","0","follow, noindex","","noindex","","","","","","","","211636","56004","56004","21,454","","290","52","5,577","49,770","Difficile","1,288","2","2","","6","2","0","1,600","42","25","0","7","6","0","","","","","4ed7626bc6d1828d4fe287f1e70e5b49","0,581","","","","","fr-FR","1.1","","","","","","https://vintagefrenchart.com/my-account/lost-password/","2026-03-05 19:57:02"
"https://vintagefrenchart.com/categorie-produit/objets-dart-et-decoration/page/2/","text/html; charset=UTF-8","200","OK","Indexable","","Objets d'art et décoration 2 | Vintage French Art","49","423","","0","0","Objets d’Art et décoration Mon métier de brocanteur à Castres me permet de chiner (achat d’objets anciens) et revendre des objets d’art contemporain, des objets du XVIIe siècle,  XVIIIe siècle, XIXe siècle et XXe siècle. Je suis un passionné d’art dans sa globalité (tableaux, sculpture, statue, le design moderne …).…","318","1912","","0","","0","","0","Objets d'art et décoration","26","Tableau huile sur toile signé par le baron Pierre Arthur FOACHE (1871 / 1967)","77","index, follow, max-snippet:-1, max-image-preview:large, max-video-preview:-1","","","","https://vintagefrenchart.com/categorie-produit/objets-dart-et-decoration/page/2/","","https://vintagefrenchart.com/categorie-produit/objets-dart-et-decoration/","","","","271262","65117","65117","24,945","","372","73","5,096","63,392","Normal","1,224","2","4","","7","2","0","1,600","62","33","0","7","6","0","","","","","37c38ad32f4bd821f6a2827b0b75aa94","0,680","Thu, 05 Mar 2026 18:57:02 GMT","","","","fr-FR","1.1","","","","","","https://vintagefrenchart.com/categorie-produit/objets-dart-et-decoration/page/2/","2026-03-05 19:57:02"
"https://vintagefrenchart.com/produit/dior-foulard-vintage-soie/","text/html; charset=UTF-8","200","OK","Indexable","","Foulard Dior vintage soie 1970 | Mode luxe de collection","56","495","","0","0","Foulard Christian Dior vintage en soie de 1970. Mode luxe française de collection. Accessoire signé authentique.","112","686","","0","DIOR | foulard vintage en soie de 1970","38","","0","Foulard DIOR vintage","20","Produits similaires","19","index, follow, max-snippet:-1, max-image-preview:large, max-video-preview:-1","","","","https://vintagefrenchart.com/produit/dior-foulard-vintage-soie/","","","","","","285071","65269","65269","25,003","","499","97","5,144","74,629","Assez facile","1,375","2","2","","22","9","0","7,200","64","30","0","7","6","0","","","","","107d87f9bba1ea5ace7db32da571291d","0,124","Thu, 05 Mar 2026 09:20:25 GMT","","","","fr-FR","1.1","","","","","","https://vintagefrenchart.com/produit/dior-foulard-vintage-soie/","2026-03-05 19:57:03"
"https://vintagefrenchart.com/produit/hermes-foulard-vintage-soie/","text/html; charset=UTF-8","200","OK","Indexable","","Foulard Hermès vintage soie 1965 | Carré de collection","54","487","","0","0","Foulard Hermès vintage en soie de 1965. Carré de collection signé. Mode luxe française. Accessoire rare et authentique.","119","734","","0","HERMÈS foulard vintage en soie de 1965","38","","0","Foulard soie vintage HERMÈS","27","Produits similaires","19","index, follow, max-snippet:-1, max-image-preview:large, max-video-preview:-1","","","","https://vintagefrenchart.com/produit/hermes-foulard-vintage-soie/","","","","","","289220","65811","65811","25,211","","513","96","5,344","76,078","Assez facile","1,385","2","2","","20","8","0","6,400","64","30","0","7","6","0","","","","","be22372059beb42449a7103cded11c65","0,344","Thu, 05 Mar 2026 09:20:23 GMT","","","","fr-FR","1.1","","","","","","https://vintagefrenchart.com/produit/hermes-foulard-vintage-soie/","2026-03-05 19:57:03"
"https://vintagefrenchart.com/produit/valentino-flacon-de-parfum-geant-brocante-en-ligne/","text/html; charset=UTF-8","200","OK","Indexable","","Flacon de parfum géant Valentino | Collection parfumerie","56","510","","0","0","Flacon de parfum géant Valentino vintage de collection. Objet décoratif luxe pour amateur de parfumerie. Pièce rare.","116","715","","0","Valentino Flacon de parfum géant","32","Valentino Flacon de parfum Géant","32","Produits similaires","19","Vanderbilt Flacon de parfum géant","33","index, follow, max-snippet:-1, max-image-preview:large, max-video-preview:-1","","","","https://vintagefrenchart.com/produit/valentino-flacon-de-parfum-geant-brocante-en-ligne/","","","","","","295582","65757","65757","25,190","","469","93","5,043","71,840","Assez facile","1,261","2","2","","23","7","0","5,600","64","32","0","7","6","0","","","","","4eb0b1087eb6edb0f722b2d1cf1b578d","0,368","Thu, 05 Mar 2026 09:07:59 GMT","","","","fr-FR","1.1","","","","","","https://vintagefrenchart.com/produit/valentino-flacon-de-parfum-geant-brocante-en-ligne/","2026-03-05 19:57:03"
"https://vintagefrenchart.com/produit/omega-seamaster-automatic-montre-collection-1960/","text/html; charset=UTF-8","200","OK","Indexable","","Montre Omega Seamaster Automatic 1960 | Collection vintage","58","559","","0","0","Montre Omega Seamaster Automatic de 1960. Horlogerie suisse vintage de collection. Mouvement automatique d'origine.","115","749","","0","Montre de collection Omega Seamaster Automatic 1960","51","","0","Belle Omega Seamaster Automatic 1960 | montre de collection","59","Descriptif détaillé d’Omega Seamaster Automatic 1960","52","index, follow, max-snippet:-1, max-image-preview:large, max-video-preview:-1","","","","https://vintagefrenchart.com/produit/omega-seamaster-automatic-montre-collection-1960/","","","","","","275587","65397","65397","25,052","","497","96","5,177","63,531","Normal","1,482","2","2","","20","6","0","4,800","56","28","0","7","6","0","","","","","6af07621a8037ab530b7facb799614b","0,237","Thu, 05 Mar 2026 09:24:13 GMT","","","","fr-FR","1.1","","","","","","https://vintagefrenchart.com/produit/omega-seamaster-automatic-montre-collection-1960/","2026-03-05 19:57:04"
"https://vintagefrenchart.com/produit/montre-de-collection-jaeger-lecoultre-montre-de-poche/","text/html; charset=UTF-8","200","OK","Indexable","","Montre Jaeger-LeCoultre 1930 gousset | Collection horlogerie","60","548","","0","0","Montre à gousset Jaeger-LeCoultre de 1930. Horlogerie suisse de collection. Pièce vintage en état de fonctionnement.","116","724","","0","Jaeger-LeCoultre (1930) : Montre à gousset de collection","56","","0","Montre à gousset de collection Jaeger – Lecoultre (modèle 467/2)","64","Descriptif détaillé","19","index, follow, max-snippet:-1, max-image-preview:large, max-video-preview:-1","","","","https://vintagefrenchart.com/produit/montre-de-collection-jaeger-lecoultre-montre-de-poche/","","","","","","275541","65275","65275","25,006","","469","90","5,211","70,587","Assez facile","1,401","2","2","","20","6","0","4,800","56","28","0","7","6","0","","","","","eb14f88c3e9f9015d25f4ca4199ec8c7","0,100","Thu, 05 Mar 2026 09:28:04 GMT","","","","fr-FR","1.1","","","","","","https://vintagefrenchart.com/produit/montre-de-collection-jaeger-lecoultre-montre-de-poche/","2026-03-05 19:57:04"
"https://vintagefrenchart.com/produit/brocante-en-ligne-montre-vintage-sicura/","text/html; charset=UTF-8","200","OK","Indexable","","Montre vintage Sicura | Collection horlogerie suisse","52","457","","0","0","Montre vintage Sicura de collection. Horlogerie suisse accessible. Pièce rétro en état de fonctionnement.","105","639","","0","Montre vintage SICURA","21","","0","Vintage French Art | Brocante en ligne propose à la vente une montre vintage SICURA","83","Marque de la montre","19","index, follow, max-snippet:-1, max-image-preview:large, max-video-preview:-1","","","","https://vintagefrenchart.com/produit/brocante-en-ligne-montre-vintage-sicura/","","","","","","283342","66011","66011","25,288","","524","107","4,897","68,022","Normal","1,478","2","2","","29","9","0","7,200","69","31","0","7","6","0","","","","","ff99422e43ba2dec4e9a74f3ef7086a4","0,215","Thu, 05 Mar 2026 09:28:11 GMT","","","","fr-FR","1.1","","","","","","https://vintagefrenchart.com/produit/brocante-en-ligne-montre-vintage-sicura/","2026-03-05 19:57:04"
"https://vintagefrenchart.com/boutique","text/html; charset=UTF-8","301","Moved Permanently","Non indexable","Redirigé","","0","0","","0","0","","0","0","","0","","0","","0","","0","","0","","","","","","","","","","","0","0","0","0,000","","0","","","","","0,000","2","0","","0","0","0","0,000","0","0","0","0","0","0","","","","","","0,421","","https://vintagefrenchart.com/boutique/","Redirection HTTP","","","1.1","","","","","","https://vintagefrenchart.com/boutique","2026-03-05 19:57:06"
"https://vintagefrenchart.com/articles-brocante-monde/","text/html; charset=UTF-8","200","OK","Indexable","","Brocante dans le monde  | Vintage French Art","44","398","","0","0","","0","0","","0","Catégorie Brocante dans le monde","32","","0","Petit tour du monde des marchés aux puces !","43","","0","index, follow, max-snippet:-1, max-image-preview:large, max-video-preview:-1","","","","https://vintagefrenchart.com/articles-brocante-monde/","","","","","","215683","56594","56594","21,680","","336","64","5,250","56,729","Assez difficile","1,390","2","1","","32","22","0","17,600","52","31","0","7","6","0","","","","","7d6c6e790568609ff2d8c179e0ddeff2","0,266","Thu, 05 Mar 2026 09:28:15 GMT","","","","fr-FR","1.1","","","","","","https://vintagefrenchart.com/articles-brocante-monde/","2026-03-05 19:57:06"
