"Adresse","Type de contenu","Code HTTP","Statut","Indexabilité","Statut d'indexabilité","Title 1","Longueur du Title 1","Largeur en pixels du Title 1","Title 2","Longueur du Title 2","Largeur en pixels du Title 2","Meta Description 1","Longueur de la Meta Description 1","Largeur en pixels de la Meta Description 1","Meta Keywords 1","Longueur des Meta Keywords 1","H1-1","Longueur du H1-1","H1-2","Longueur du H1-2","H2-1","Longueur du H2-1","H2-2","Longueur du H2-2","Meta Robots 1","Meta Robots 2","Balise X-Robots 1","Meta Refresh 1","Élément de lien en version canonique 1","rel=""next"" 1","rel=""prev"" 1","HTTP rel=""next"" 1","HTTP rel=""prev"" 1","Élément de lien amphtml","Taille (octets)","Transféré (octets)","Total transféré (en octets)","CO2 (mg)","Empreinte carbone","Nombre de mots","Nombre de phrases","Moyenne de mots par phrase","Score de lisibilité de Flesch","Lisibilité","Ratio texte","Crawl profondeur","Profondeur du dossier","Link Score","Liens entrants","Liens entrants uniques","Liens entrants JS uniques","% du total","Liens sortants","Liens sortants uniques","Liens sortants JS uniques","Liens sortants externes","Liens sortants externes uniques","Liens sortants JS externes uniques","Quasi-doublon le plus proche","Nombre de quasi-doublons","Erreurs d'orthographe","Erreurs de grammaire","Hachage","Temps de réponse","Last Modified","URL de redirection","Type de redirection","Cookies","Language","Version HTTP","Lien alternate mobile","Adresse sémantiquement similaire la plus proche","Score de similarité sémantique","Nbre sémantiquement similaires","Score de pertinence sémantique","Adresse codée en URL","Horodatage du crawl"
"https://vintagefrenchart.com/","text/html; charset=UTF-8","200","OK","Indexable","","Vintage French Art | Brocante en Ligne & Antiquaire Castres (Tarn 81)","69","618","","0","0","Brocanteur et antiquaire a Castres dans le Tarn. Achetez en ligne des objets vintage, plaques emaillees, luminaires et meubles anciens.","135","824","","0","","0","","0","Brocante en Ligne et à Castres :","32","Nos dernières trouvailles","25","index, follow, max-snippet:-1, max-image-preview:large, max-video-preview:-1","","","","https://vintagefrenchart.com/","","","","","","284076","65010","65010","24,904","","581","104","5,587","59,194","Assez difficile","1,624","0","0","","730","125","0","100,000","58","31","0","7","6","0","","","","","2280be355e52794d34e89f4af3a38581","0,419","Thu, 05 Mar 2026 18:52:27 GMT","","","","fr-FR","1.1","","","","","","https://vintagefrenchart.com/","2026-03-05 19:56:29"
"https://vintagefrenchart.com/produit/flavio-poli-bol-en-verre-de-murano-italien/","text/html; charset=UTF-8","200","OK","Indexable","","Bol verre de Murano Flavio Poli | Design italien vintage","56","483","","0","0","Bol en verre de Murano italien par Flavio Poli. Design Sommerso vintage de collection. Verrerie d'art signée.","109","653","","0","Flavio POLI : Bol en verre de Murano italien","44","","0","Flavio POLI Coupe Bol en verre de Murano italien – 1950/60","58","Flavio Poli 1900/1984","21","index, follow, max-snippet:-1, max-image-preview:large, max-video-preview:-1","","","","https://vintagefrenchart.com/produit/flavio-poli-bol-en-verre-de-murano-italien/","","","","","","309866","67670","67670","25,923","","661","130","5,085","75,734","Assez facile","1,552","1","2","","27","11","0","8,800","65","32","0","7","6","0","","","","","37fb7b1a3e98f707fccfb1d32aaa401a","0,462","Thu, 05 Mar 2026 09:07:08 GMT","","","","fr-FR","1.1","","","","","","https://vintagefrenchart.com/produit/flavio-poli-bol-en-verre-de-murano-italien/","2026-03-05 19:56:31"
"https://vintagefrenchart.com/categorie-produit/jouets-vintage/","text/html; charset=UTF-8","200","OK","Indexable","","Jouets Vintage et jeux de Collection  | Vintage French Art","58","503","","0","0","Jouet vintage et jeux de Collection Votre brocante en ligne Vintage French Art, située aux alentours de Castres en France, vous présente sa catégorie jouet vintage et de collection. Un jouet ancien, que ce soit un lot de poupée ou une figurine vintage fait appel aux souvenirs de notre enfance.…","295","1782","","0","","0","","0","Jouets Vintage et jeux de Collection","36","JOUSTRA Le chat joueur","22","index, follow, max-snippet:-1, max-image-preview:large, max-video-preview:-1","","","","https://vintagefrenchart.com/categorie-produit/jouets-vintage/","","","","","","265403","63786","63786","24,435","","364","69","5,275","63,192","Normal","1,236","1","2","","146","125","0","100,000","59","31","0","7","6","0","","","","","21b310dc16135f8a8b466cbc09a0c5f1","0,179","Thu, 05 Mar 2026 09:43:24 GMT","","","","fr-FR","1.1","","","","","","https://vintagefrenchart.com/categorie-produit/jouets-vintage/","2026-03-05 19:56:33"
"https://vintagefrenchart.com/boutique/","text/html; charset=UTF-8","200","OK","Indexable","","Boutique  | Vintage French Art","30","261","","0","0","Explorez notre boutique d'art vintage français. Affiches, illustrations et œuvres originales soigneusement sélectionnées. Pièces uniques et authentiques pour décorer votre intérieur.","182","1105","","0","","0","","0","Brocante en ligne d’objets vintage rares et authentiques","56","Ancienne plaque émaillée ODO double face | Publicité Vintage","60","index, follow, max-snippet:-1, max-image-preview:large, max-video-preview:-1","","","","https://vintagefrenchart.com/boutique/","https://vintagefrenchart.com/boutique/page/2/","","","","","382532","70960","70960","27,183","","864","157","5,503","75,231","Assez facile","1,605","1","1","","259","125","0","100,000","125","59","0","7","6","0","","","","","c33d56e7930d3ee08ac4aa0620f3c065","0,253","Thu, 05 Mar 2026 09:06:21 GMT","","","","fr-FR","1.1","","","","","","https://vintagefrenchart.com/boutique/","2026-03-05 19:56:33"
"https://vintagefrenchart.com/produit/plaque-emaillee-ancienne-odo/","text/html; charset=UTF-8","200","OK","Indexable","","Plaque émaillée ancienne ODO double face | Publicité vintage","60","549","","0","0","Ancienne plaque émaillée ODO double face. Publicité vintage d'horlogerie pour collectionneurs. Pièce authentique et rare.","121","740","","0","Ancienne plaque émaillée ODO double face | Publicité Vintage","60","","0","Ancienne plaque publicitaire émaillée ODO double face","53","Caractéristiques de la plaque vintage ODO :","43","index, follow, max-snippet:-1, max-image-preview:large, max-video-preview:-1","","","","https://vintagefrenchart.com/produit/plaque-emaillee-ancienne-odo/","","","","","","303213","67181","67181","25,736","","638","119","5,361","70,117","Assez facile","1,633","1","2","","20","8","0","6,400","65","31","0","7","6","0","","","","","6f461daec8d5b2f403fc37493cd557df","0,137","Thu, 05 Mar 2026 09:07:25 GMT","","","","fr-FR","1.1","","","","","","https://vintagefrenchart.com/produit/plaque-emaillee-ancienne-odo/","2026-03-05 19:56:33"
"https://vintagefrenchart.com/contact/","text/html; charset=UTF-8","200","OK","Indexable","","Contact | Vintage French Art, Brocanteur Castres (Tarn)","55","493","","0","0","Contactez Vintage French Art pour une estimation gratuite, un achat ou une question. Brocanteur et antiquaire dans le Tarn a Castres.","133","828","","0","","0","","0","Contactez-moi","13","","0","index, follow, max-snippet:-1, max-image-preview:large, max-video-preview:-1","","","","https://vintagefrenchart.com/contact/","","","","","","285760","65835","65835","25,220","","421","85","4,953","55,315","Assez difficile","1,277","1","1","","295","125","0","100,000","43","24","0","7","6","0","","","","","8ab542290dc60b872bff9f630d751f69","0,144","Thu, 05 Mar 2026 08:56:12 GMT","","","","fr-FR","1.1","","","","","","https://vintagefrenchart.com/contact/","2026-03-05 19:56:34"
"https://vintagefrenchart.com/cart/","text/html; charset=UTF-8","200","OK","Non indexable","noindex","Cart | Vintage French Art","25","220","","0","0","","0","0","","0","Cart","4","","0","","0","","0","follow, noindex","","","","","","","","","","214379","56372","56372","21,595","","262","49","5,347","48,676","Difficile","1,173","1","1","","378","125","0","100,000","39","24","0","7","6","0","","","","","9476e9461b0e08534c2ff87ae2521636","0,907","","","","","fr-FR","1.1","","","","","","https://vintagefrenchart.com/cart/","2026-03-05 19:56:34"
"https://vintagefrenchart.com/brocante-castres/","text/html; charset=UTF-8","200","OK","Indexable","","Brocante a Castres : Marches, Antiquaires & Foires | Guide Local","64","570","","0","0","Tout savoir sur la brocante a Castres : marches d'antiquites, foires, brocanteurs locaux et histoire du marche aux puces castrain. Guide complet.","145","886","","0","","0","","0","La brocante à Castres ( Tarn)","29","Le passé de la brocante à Castres (Occitanie, Tarn, 81)","55","index, follow, max-snippet:-1, max-image-preview:large, max-video-preview:-1","","","","https://vintagefrenchart.com/brocante-castres/","","","","","","237920","61926","61926","23,723","","1700","238","7,143","75,123","Assez facile","4,763","1","1","","141","125","0","100,000","54","24","0","7","6","0","","","","","ae0336c9f70c7cd149a5b59e29d85e16","0,226","Thu, 05 Mar 2026 09:06:18 GMT","","","","fr-FR","1.1","","","","","","https://vintagefrenchart.com/brocante-castres/","2026-03-05 19:56:35"
"https://vintagefrenchart.com/presentation/","text/html; charset=UTF-8","200","OK","Indexable","","Qui Sommes-Nous | Vintage French Art, Brocanteur dans le Tarn","61","571","","0","0","Vintage French Art : brocanteur et antiquaire passionne base dans le Tarn. Notre histoire, notre passion pour les objets vintage et anciens.","140","848","","0","","0","","0","Qui suis je","11","L’ART ET LA BROCANTE, UNE PASSION DEPUIS PLUS DE 36 ANS","55","index, follow, max-snippet:-1, max-image-preview:large, max-video-preview:-1","","","","https://vintagefrenchart.com/presentation/","","","","","","342488","70413","70413","26,974","","887","140","6,336","54,953","Assez difficile","2,015","1","1","","256","125","0","100,000","43","24","0","7","6","0","","","","","a6bad64a69eae75769afc28978f8f953","0,606","Thu, 05 Mar 2026 18:55:59 GMT","","","","fr-FR","1.1","","","","","","https://vintagefrenchart.com/presentation/","2026-03-05 19:56:36"
"https://www.vintagefrenchart.com/blog/","text/html; charset=iso-8859-1","301","Moved Permanently","Non indexable","Redirigé","","0","0","","0","0","","0","0","","0","","0","","0","","0","","0","","","","","","","","","","","282","282","282","0,108","","0","","","","","0,000","1","1","","1","1","0","0,800","0","0","0","0","0","0","","","","","","1,963","","https://vintagefrenchart.com/blog/","Redirection HTTP","","","1.1","","","","","","https://www.vintagefrenchart.com/blog/","2026-03-05 19:56:36"
"https://vintagefrenchart.com/conditions-generales-vente/","text/html; charset=UTF-8","200","OK","Non indexable","noindex","Conditions générales de vente | Vintage French Art | Brocante","61","547","","0","0","Conditions générales de vente de la brocante en ligne Castraise Vintage French Art","82","507","","0","","0","","0","Conditions générales de vente","29","","0","follow, noindex","","","","","","","","","","263727","70052","70052","26,836","","6205","790","7,854","68,779","Normal","15,347","1","1","","130","125","0","100,000","43","24","0","8","7","0","","","","","5dc0650b8a808c9330b7f730b94b822e","0,319","Thu, 05 Mar 2026 08:56:16 GMT","","","","fr-FR","1.1","","","","","","https://vintagefrenchart.com/conditions-generales-vente/","2026-03-05 19:56:37"
"https://vintagefrenchart.com/categorie-produit/assises/","text/html; charset=UTF-8","200","OK","Indexable","","Chaise et fauteuil vintage  | Vintage French Art","48","410","","0","0","Votre brocante proche de Castres Vintage French Art, vous propose   tout ce qui est relatif aux assises. Les canapés, les banquettes, les tabourets, chaises et fauteuils  sont des pièces maîtresses de notre décoration intérieure, qui reflètent notre personnalité et notre sens de l’hospitalité. L’univers des assises est riche et varié…","336","1989","","0","","0","","0","Chaise et fauteuil vintage","26","Chaises scandinaves Fanett d’Ilmari Tapiovaara","46","index, follow, max-snippet:-1, max-image-preview:large, max-video-preview:-1","","","","https://vintagefrenchart.com/categorie-produit/assises/","","","","","","276006","64228","64228","24,605","","391","74","5,284","62,996","Normal","1,243","1","2","","154","125","0","100,000","63","33","0","7","6","0","","","","","cbf412e5bd0f886ec3ad4ce27d762de8","0,370","Thu, 05 Mar 2026 09:43:22 GMT","","","","fr-FR","1.1","","","","","","https://vintagefrenchart.com/categorie-produit/assises/","2026-03-05 19:56:37"
"https://vintagefrenchart.com/conditions-generales-utilisation/","text/html; charset=UTF-8","200","OK","Non indexable","noindex","Conditions générales d'utilisation | Vintage French Art","55","477","","0","0","Ici vous trouverez les conditions générales d'utilisation de Vintage French Art la brocante en ligne de Castres dans le Tarn (81) et toute la France.","149","886","","0","","0","","0","Conditions générales d’utilisation","34","","0","follow, noindex","","","","","","","","","","230888","61415","61415","23,527","","2184","293","7,454","57,611","Assez difficile","6,586","1","1","","130","125","0","100,000","43","24","0","7","6","0","","","","","c2f609567a05df8b8d101071bbdd38f3","0,327","Thu, 05 Mar 2026 08:56:14 GMT","","","","fr-FR","1.1","","","","","","https://vintagefrenchart.com/conditions-generales-utilisation/","2026-03-05 19:56:38"
"https://vintagefrenchart.com/categorie-produit/objets-dart-et-decoration/","text/html; charset=UTF-8","200","OK","Indexable","","Objets d'art et décoration  | Vintage French Art","48","407","","0","0","Objets d’Art et décoration Mon métier de brocanteur à Castres me permet de chiner (achat d’objets anciens) et revendre des objets d’art contemporain, des objets du XVIIe siècle,  XVIIIe siècle, XIXe siècle et XXe siècle. Je suis un passionné d’art dans sa globalité (tableaux, sculpture, statue, le design moderne …).…","318","1912","","0","","0","","0","Objets d'art et décoration","26","Flavio POLI : Bol en verre de Murano italien","44","index, follow, max-snippet:-1, max-image-preview:large, max-video-preview:-1","","","","https://vintagefrenchart.com/categorie-produit/objets-dart-et-decoration/","https://vintagefrenchart.com/categorie-produit/objets-dart-et-decoration/page/2/","","","","","363596","67867","67867","25,999","","688","129","5,333","74,891","Assez facile","1,391","1","2","","250","125","0","100,000","103","49","0","7","6","0","","","","","d317c7d71bb1c2d761de04931d9ebf69","0,391","Thu, 05 Mar 2026 09:43:20 GMT","","","","fr-FR","1.1","","","","","","https://vintagefrenchart.com/categorie-produit/objets-dart-et-decoration/","2026-03-05 19:56:39"
"https://vintagefrenchart.com/my-account/woo-wish-list/","text/html; charset=UTF-8","200","OK","Non indexable","noindex","My account | Vintage French Art","31","284","","0","0","","0","0","","0","My account","10","","0","Se connecter","12","","0","follow, noindex","","","","","","","","","","209296","55004","55004","21,071","","277","52","5,327","51,164","Assez difficile","1,260","1","2","","254","125","0","100,000","43","25","0","7","6","0","","","","","69aa1fbbdf07074b9453350bd59266fc","1,116","","","","","fr-FR","1.1","","","","","","https://vintagefrenchart.com/my-account/woo-wish-list/","2026-03-05 19:56:40"
"https://vintagefrenchart.com/foire-aux-questions/","text/html; charset=UTF-8","200","OK","Indexable","","FAQ Brocante | Questions Frequentes | Vintage French Art","56","516","","0","0","Foire aux questions : réponses a vos questions sur la brocante en ligne, les estimations, la livraison et l'achat d'antiquités chez Vintage French Art.","151","893","","0","","0","","0","faq","3","","0","index, follow, max-snippet:-1, max-image-preview:large, max-video-preview:-1","","","","https://vintagefrenchart.com/foire-aux-questions/","","","","","","284219","64697","64697","24,784","","502","78","6,436","66,493","Normal","1,386","1","1","","256","125","0","100,000","43","24","0","10","9","0","","","","","c0815f607189782abee97e109ce4edd","0,568","Thu, 05 Mar 2026 08:56:10 GMT","","","","fr-FR","1.1","","","","","","https://vintagefrenchart.com/foire-aux-questions/","2026-03-05 19:56:42"
"https://vintagefrenchart.com/categorie-produit/mode-luxe-vintage/","text/html; charset=UTF-8","200","OK","Indexable","","Mode Luxe vintage  | Vintage French Art","39","351","","0","0","Vintage French Art votre antiquaire / brocanteur à Castres vous présente une grande fierté française : La Mode. Inscrite au patrimoine culturel français, la mode à la française est un art de vivre, de penser.  La mode a souvent été avant-gardiste, novatrice et transgressive insufflant de nouveaux codes à la…","309","1872","","0","","0","","0","Mode Luxe vintage","17","HERMES BelAmi Flacon de parfum géant","36","index, follow, max-snippet:-1, max-image-preview:large, max-video-preview:-1","","","","https://vintagefrenchart.com/categorie-produit/mode-luxe-vintage/","","","","","","303163","64966","64966","24,887","","486","95","5,116","73,872","Assez facile","1,274","1","2","","185","125","0","100,000","75","35","0","7","6","0","","","","","6614edd1312fb44cae029cb2381b9fad","0,146","Thu, 05 Mar 2026 09:28:24 GMT","","","","fr-FR","1.1","","","","","","https://vintagefrenchart.com/categorie-produit/mode-luxe-vintage/","2026-03-05 19:56:43"
"https://vintagefrenchart.com/categorie-produit/montre-vintage/","text/html; charset=UTF-8","200","OK","Indexable","","Montres vintage - Montres de collection  | Vintage French Art","61","535","","0","0","Les montres vintage – Les montres de collection Amateur de belles montres vintage de collection ? Votre brocante de Castres aussi ! Venez découvrir nos prestigieuses montres de collection des plus grandes marques à tous les prix. L’univers de la montre de luxe vintage me fait rêver depuis tout petit,…","302","1849","","0","","0","","0","Montres vintage - Montres de collection","39","Jaeger-LeCoultre (1930) : Montre à gousset de collection","56","index, follow, max-snippet:-1, max-image-preview:large, max-video-preview:-1","","","","https://vintagefrenchart.com/categorie-produit/montre-vintage/","","","","","","275087","64107","64107","24,558","","396","76","5,211","64,605","Normal","1,265","1","2","","157","125","0","100,000","63","32","0","7","6","0","","","","","9f32b9da1ae7f4da1148a3eea2bdbc4","0,099","Thu, 05 Mar 2026 09:43:13 GMT","","","","fr-FR","1.1","","","","","","https://vintagefrenchart.com/categorie-produit/montre-vintage/","2026-03-05 19:56:43"
"https://vintagefrenchart.com/politique-de-cookie/","text/html; charset=UTF-8","200","OK","Non indexable","noindex","Politique de cookies | Vintage French Art | Brocante Castres","60","530","","0","0","Politique de cookies de Vintage French Art, boutique en ligne de brocante à Castres dans le Tarn (81). Gestion et utilisation des cookies sur notre site.","153","914","","0","","0","","0","Politique de cookies","20","","0","follow, noindex","","","","","","","","","","224373","59885","59885","22,941","","1506","262","5,748","60,506","Normal","4,808","1","1","","130","125","0","100,000","43","24","0","7","6","0","","","","","99976e228bb3ca5f69bd86fcefc0021c","0,121","Thu, 05 Mar 2026 09:06:14 GMT","","","","fr-FR","1.1","","","","","","https://vintagefrenchart.com/politique-de-cookie/","2026-03-05 19:56:43"
"https://vintagefrenchart.com/produit/hermes-belami-flacon-de-parfum-geant-brocante-en-ligne/","text/html; charset=UTF-8","200","OK","Indexable","","Flacon de parfum géant Hermès BelAmi | Collection luxe","54","503","","0","0","Flacon de parfum géant Hermès BelAmi de collection. Objet vintage parfumerie de luxe française. Décoration raffinée.","116","722","","0","HERMES BelAmi Flacon de parfum géant","36","HERMES flacon de parfum géant","29","Produits similaires","19","Nina RICCI Flacon de parfum géant NiNa","38","index, follow, max-snippet:-1, max-image-preview:large, max-video-preview:-1","","","","https://vintagefrenchart.com/produit/hermes-belami-flacon-de-parfum-geant-brocante-en-ligne/","","","","","","290864","65710","65710","25,172","","476","93","5,118","71,719","Assez facile","1,296","1","2","","29","9","0","7,200","64","32","0","7","6","0","","","","","eca9820afe62b0a774d68bd1bcf81e36","0,121","Thu, 05 Mar 2026 09:07:55 GMT","","","","fr-FR","1.1","","","","","","https://vintagefrenchart.com/produit/hermes-belami-flacon-de-parfum-geant-brocante-en-ligne/","2026-03-05 19:56:43"
"https://vintagefrenchart.com/mentions-legales-et-politique-de-confidentialite/","text/html; charset=UTF-8","200","OK","Non indexable","noindex","Mentions légales et Politique de confidentialité | VFA","54","471","","0","0","Qui sommes-nous ? Ceci est la page des mentions légales et politique de confidentialité où vous trouverez toutes les informations référentes à cette dernière.","158","961","","0","","0","","0","Mentions légales et Politique de confidentialité","48","Article 1 – Mentions légales","28","follow, noindex","","","","","","","","","","233953","62604","62604","23,982","","2586","358","7,223","59,877","Assez difficile","7,657","1","1","","130","125","0","100,000","43","24","0","11","9","0","","","","","875f25d099d4c8d7c3166fe0d3656833","0,135","Thu, 05 Mar 2026 08:56:18 GMT","","","","fr-FR","1.1","","","","","","https://vintagefrenchart.com/mentions-legales-et-politique-de-confidentialite/","2026-03-05 19:56:43"
"https://www.vintagefrenchart.com/boutique","text/html; charset=iso-8859-1","301","Moved Permanently","Non indexable","Redirigé","","0","0","","0","0","","0","0","","0","","0","","0","","0","","0","","","","","","","","","","","285","285","285","0,109","","0","","","","","0,000","1","0","","2","1","0","0,800","0","0","0","0","0","0","","","","","","0,488","","https://vintagefrenchart.com/boutique","Redirection HTTP","","","1.1","","","","","","https://www.vintagefrenchart.com/boutique","2026-03-05 19:56:43"
"https://vintagefrenchart.com/blog/","text/html; charset=UTF-8","200","OK","Indexable","","Blog | Vintage French Art","25","221","","0","0","Blog Vintage French Art : conseils et découvertes sur les antiquités, brocantes et objets vintage. Conseils d'experts pour passionnés.","134","810","","0","","0","","0","La décoration industrielle, pour un salon d’histoire et d’audace","64","La décoration campagne chic, pour un intérieur country","54","index, follow, max-snippet:-1, max-image-preview:large, max-video-preview:-1","","","","https://vintagefrenchart.com/blog/","https://vintagefrenchart.com/blog/page/2/","","","","","287027","63888","63888","24,474","","897","166","5,404","76,667","Assez facile","2,177","1","1","","279","125","0","100,000","102","43","0","7","6","0","","","","","3442a09687eeee8067af87908f79a87c","0,102","Thu, 05 Mar 2026 09:59:57 GMT","","","","fr-FR","1.1","","","","","","https://vintagefrenchart.com/blog/","2026-03-05 19:56:44"
"https://vintagefrenchart.com/categorie-produit/decoration-vintage/","text/html; charset=UTF-8","200","OK","Indexable","","Décoration vintage  | Vintage French Art","40","350","","0","0","La décoration d’intérieur vintage est très tendance. De la chambre d’enfant, à  la salle de bain en passant par les cuisines, salle à manger ou salon vintage chaque pièce de la maison peut recevoir une ambiance chaleureuse avec de la décoration rétro authentique et les idées déco vintage  ne manquent…","302","1844","","0","","0","","0","Décoration vintage","18","Flavio POLI : Bol en verre de Murano italien","44","index, follow, max-snippet:-1, max-image-preview:large, max-video-preview:-1","","","","https://vintagefrenchart.com/categorie-produit/decoration-vintage/","","","","","","277657","64769","64769","24,812","","409","79","5,177","62,373","Normal","1,274","1","2","","165","125","0","100,000","67","34","0","7","6","0","","","","","20a6d3487459d716b7b05c90e69ea3dd","0,122","Thu, 05 Mar 2026 09:43:18 GMT","","","","fr-FR","1.1","","","","","","https://vintagefrenchart.com/categorie-produit/decoration-vintage/","2026-03-05 19:56:44"
"https://vintagefrenchart.com/categorie-produit/meuble-ancien/","text/html; charset=UTF-8","200","OK","Indexable","","Meuble ancien  | Vintage French Art","35","312","","0","0","Retrouvez tout le mobilier vintage que vous recherchez. Grand designers, au mobilier classique en passant par l’industriel tout y est !","135","810","","0","","0","","0","Meuble ancien","13","« Carina » : Coiffeuse / secrétaire vintage scandinave années 60","64","index, follow, max-snippet:-1, max-image-preview:large, max-video-preview:-1","","","","https://vintagefrenchart.com/categorie-produit/meuble-ancien/","","","","","","267042","64437","64437","24,685","","360","71","5,070","62,804","Normal","1,212","1","2","","146","125","0","100,000","59","30","0","7","6","0","","","","","d259953bd0597646c0fdffa509317cbc","0,223","Thu, 05 Mar 2026 09:43:06 GMT","","","","fr-FR","1.1","","","","","","https://vintagefrenchart.com/categorie-produit/meuble-ancien/","2026-03-05 19:56:43"
