"https://www.beyondmeat.com/en-US/recipes/beyond-steak-bulgogi-rice-balls","1","Try vegan bulgogi rice balls with seasoned Beyond Steak and filled with flavorful Korean-inspired seasonings for a fun, on the go plant-based snack.","148","908","Indexable",""
"https://www.beyondmeat.com/en-US/recipes/beyond-bbq-chicken-pinwheels","1","These BBQ Chicken Pinwheels with Beyond Chicken are perfect vegan appetizers, easy to make and packed with BBQ flavor for your next gathering.","142","909","Indexable",""
"https://www.beyondmeat.com/en-US/products/beyond-chicken-nuggets","1","Discover the ultimate vegan chicken nuggets with Beyond. Quick and delicious, these plant-based nuggets are kid approved and ready to enjoy in minutes.","151","946","Indexable",""
"https://www.beyondmeat.com/en-US/recipes/shay-mitchells-beyond-lettuce-wraps","1","Savor the taste of Shay Mitchell's Beyond Lettuce Wraps - a delicious vegan recipe featuring Beyond Beef. Perfect for a satisfying, healthy meal.","145","881","Indexable",""
"https://www.beyondmeat.com/en-US/recipes/beyond-beef-and-cauliflower-rice-taco-bowl","1","This recipe offers a flavorful vegan taco bowl featuring Beyond Beef, paired with fresh vegetables and a zesty blend of spices for a satisfying meal.","149","900","Indexable",""
"https://www.beyondmeat.com/en-US/recipes/beyond-beef-egg-roll-in-a-bowl","1","Discover the goodness of a vegan egg roll in a bowl. This Beyond recipe offers a fun, plant-based twist to a delicious classic egg roll recipe.","143","847","Indexable",""
"https://www.beyondmeat.com/en-US/recipes/beyond-beef-taco-bowls","1","Satisfy your cravings with a mouthwatering vegan taco bowl. This Beyond Meat plant-based option offers a tasty & sustainable alternative for a delicious meal.","158","981","Indexable",""
"https://www.beyondmeat.com/en-US/recipes/royal-beyond-beef-gujeolpan","1","Savor our Royal Vegan Gujeolpan recipe, with seasoned Beyond Beef, sautéed veggies, and a garlic mustard sauce. A delicious vegan twist on a korean classic!","156","977","Indexable",""
"https://www.beyondmeat.com/en-US/products/beyond-stack-burger","1","Satisfy your cravings with our mouthwatering plant-based burger patty. Stack up the flavor with Beyond's delicious and sustainable burger option.","145","902","Indexable",""
"https://www.beyondmeat.com/en-US/recipes/beyond-burrata-burger","1","Elevate your Beyond Burger patty with a creamy burrata or plant-based mozzarella, fresh veggies, and delicious fresh flavors for a gourmet, plant-based meal.","157","972","Indexable",""
"https://www.beyondmeat.com/en-US/recipes/beyond-stuffed-steakhouse-burger","1","Elevate your burger game with this vegan hamburger recipe featuring a blue cheese stuffed Beyond Burger and homemade steak sauce. Gourmet flavor in every bite!","159","1014","Indexable",""
"https://www.beyondmeat.com/en-US/recipes/beyond-burger-pizza","1","Craft this delicious vegetarian burger pizza quickly & effortlessly. Beyond adds a delightful, plant-based twist to this classic recipe in no time.","147","862","Indexable",""
"https://www.beyondmeat.com/en-US/recipes/beef-lo-mein-by-beyond-meat","1","Try our vegetarian lo mein recipe for a delicious plant-based twist to this classic dish, making it an excellent choice for those seeking a meatless alternative.","161","950","Indexable",""
"https://www.beyondmeat.com/en-US/recipes/beyond-steak-breakfast-bowl","1","Fuel your day with plant-based nutrition with our Vegetarian Breakfast Bowl featuring Beyond Steak - a hearty plant-based breakfast option for a great morning.","159","988","Indexable",""
"https://www.beyondmeat.com/en-US/recipes/beyond-burger-grilled-cheese-by-april-ross","1","Indulge in the classic goodness of our vegan grilled cheese sandwich. Beyond adds a mouthwatering and eco-friendly twist to this childhood favorite.","148","917","Indexable",""
"https://www.beyondmeat.com/en-US/recipes/scalloped-potatoes-w-beyond-burger","1","Indulge in this creamy vegan scalloped potatoes recipe with Beyond Burger, offering a hearty, plant-based twist on a classic comfort dish.","138","846","Indexable",""
"https://www.beyondmeat.com/en-US/recipes/beyond-sausage-stuffed-peppers-2","1","Enjoy our tasty vegan stuffed peppers recipe filled with Beyond Sausage, grains, and veggies for a delicious, plant-based meal bursting with flavor.","148","899","Indexable",""
"https://www.beyondmeat.com/en-US/recipes/sweet-italian-sausage-pizza","1","Enjoy the perfect blend of flavors in our Meatless Italian Sausage Pizza recipe. A delicious, plant-based version of a favorite, it's a slice of Italian heaven.","160","929","Indexable",""
"https://www.beyondmeat.com/en-US/recipes/breakfast-pancake-bake","1","Try our vegan breakfast sausage baked pancake, a vegan pancake bake recipe featuring savory Beyond Sausage. Perfect for a quick and delicious breakfast!","152","968","Indexable",""
"https://www.beyondmeat.com/en-US/recipes/beyond-breakfast-sausage-meal-prep-egg-cups","1","Looking for a quick, on-the-go breakfast? Try our Beyond breakfast sausage meal prep egg cups, a vegan recipe featuring feta, spinach, and roasted red peppers!","159","992","Indexable",""
"https://www.beyondmeat.com/en-US/recipes/beyond-sausage-korean-corn-dogs","1","Indulge in a mouthwatering Vegan Korean Corn Dog with Beyond Sausage - a delicious and savory vegetarian twist on a popular and satisfying Korean street food.","158","1004","Indexable",""
"https://www.beyondmeat.com/en-US/recipes/beyond-beef-breakfast-casserole","1","This vegan Breakfast Casserole combines Beyond Beef, veggies, and spices for a savory breakfast dish, perfect for starting the day with plant-based flavor.","155","955","Indexable",""
"https://www.beyondmeat.com/en-US/recipes/friendsgiving-beyond-beef-mac-n-cheese","1","Perfect for Friendsgiving, this vegan mac 'n cheese recipe features Beyond Beef for a savory, creamy dish that's comforting and deliciously plant-based.","152","930","Indexable",""
"https://www.beyondmeat.com/en-US/recipes/protein-packed-lentil-pasta-with-vegan-sausage-and-roasted-veggies-by-modern-table","1","Fuel up with this protein-packed vegan lentil pasta recipe featuring Beyond Sausage, loaded with roasted veggies for a wholesome, plant-based meal.","147","918","Indexable",""
"https://www.beyondmeat.com/en-US/recipes/guacamole-beyond-burger-by-jeanine-donofrio","1","Experience a tasty twist with Vegan Guacamole Burger - a mouthwatering Vegan Guacamole Burger recipe by Jeanine Donofrio that's perfect for a satisfying meal.","158","1003","Indexable",""
"https://www.beyondmeat.com/en-US/recipes/beyond-meatballs-pasta-with-pesto","1","Whip up a mouthwatering vegan meatball pasta dish with ease. Beyond's plant-based twist offers a delightful, satisfying, and eco-friendly meal.","143","883","Indexable",""
"https://www.beyondmeat.com/en-US/recipes/beyond-sausage-po-boy","1","Enjoy a vegan po' boy sandwich with crispy Beyond Sausage, fresh toppings, and creamy sauce for a plant-based take on a classic Southern favorite.","146","917","Indexable",""
"https://www.beyondmeat.com/en-US/recipes/sausage-foil-dinner","1","Discover Sausage Foil Dinner - A creative and flavorful vegan sausage recipe idea with Beyond Sausage. Perfect for a simple and hearty family meal.","147","909","Indexable",""
"https://www.beyondmeat.com/en-US/recipes/beyond-breakfast-sausage-sandwich","1","Dive into a delectable vegan breakfast sandwich. Beyond's Sausage offers a mouthwatering and sustainable plant-based alternative for your morning delight.","154","971","Indexable",""
"https://www.beyondmeat.com/en-US/recipes/beyond-sausage-chili-dogs","1","Indulge in vegan chili dogs made with Beyond Sausage, spicy chili, and melted vegan cheese for a comforting, plant-based twist on a classic.","140","861","Indexable",""
"https://www.beyondmeat.com/en-US/recipes/beyond-sausage-shishito-pepper-sandwich","1","Savor a delicious Vegan Sausage Sandwich with Beyond Sausage - a flavorful and satisfying vegetarian recipe that's perfect for a quick and tasty meal.","150","930","Indexable",""
"https://www.beyondmeat.com/en-US/recipes/hot-italian-beyond-sausage-with-white-balsamic-vinaigrette-slaw-by-chopt","1","Learn how to make Hot Italian Beyond Sausage With White Balsamic Vinaigrette Slaw by CHOPT in a few short minutes with these common ingredients.","144","935","Indexable",""
"https://www.beyondmeat.com/en-US/recipes/beyond-burger-with-caramelized-onions-and-avocado","1","Crafted with heart health in mind, try our new Vegan Burger recipe. Enjoy a Beyond Burger patty with caramelized onions, creamy avocado, and a tangy bbq sauce.","159","1003","Indexable",""
"https://www.beyondmeat.com/en-US/recipes/beyond-double-stack-bbq-slaw-burger","1","Create a delicious vegan BBQ burger quickly. Use Beyond Burger's plant-based twist for a mouthwatering, eco-conscious touch to this classic favorite burger.","156","967","Indexable",""
"https://www.beyondmeat.com/en-US","1","","0","0","Indexable",""
"https://www.beyondmeat.com/en-US/whats-new/5-must-have-heart-healthy-recipes","1","Indulge in guilt-free dining with Beyond's collection of 5 delicious, heart-healthy recipes, all certified by the American Heart Association.","141","824","Indexable",""
"https://www.beyondmeat.com/en-US/press/beyond-meat-and-american-cancer-society-to-advance-research-on-plant-based-meat-and-cancer-prevention","1","Learn about our collaboration between Beyond and the American Cancer Society to advance research on plant-based meat and cancer prevention.","139","903","Indexable",""
"https://www.beyondmeat.com/en-US/press/beyond-steak-by-beyond-meat-is-now-certified-by-the-american-heart-association-s-heart-check-program","1","Beyond Steak by Beyond receives the American Heart Association's Heart-Check Program certification, offering heart-healthy plant-based options.","143","901","Indexable",""
"https://www.beyondmeat.com/en-US/press/beyond-sun-sausage-expands-to-whole-foods-market","1","Beyond’s Sun Sausage, our heart-healthy plant-based sausage, debuts at Whole Foods nationwide, offering 12g of protein per link and low saturated fat.","150","940","Indexable",""
"https://www.beyondmeat.com/en-US/press/beyond-meat-unveils-its-beyond-iv-platform-the-fourth-generation-of-the-beyond-burger-and-beyond-beef","1","Discover Beyond IV, the newest and tastiest Beyond Burger & Beyond Beef yet, featuring a meatier flavor and healthier ingredients. Available Spring 2024.","153","944","Indexable",""
"https://www.beyondmeat.com/en-US/press/beyond-meat-unveils-new-and-expanded-line-of-beyond-crumbles-now-certified-by-the-american-heart-association-s-heart-check-program-and-the-american-diabetes-association-s-better-choices-for-life-program","1","Explore Beyond's latest innovation: Sausage Crumbles, now certified by the American Heart Association. Discover this flavorful and nutritious vegan option!","155","956","Indexable",""
"https://www.beyondmeat.com/en-US/press/beyond-steak-the-1-new-plant-based-meat-item-in-retail-is-now-available-at-nearly-14-000-stores-nationwide-following-expanded-distribution","1","Beyond Steak, the top plant-based meat in retail, is now available at nearly 14,000 stores nationwide, showcasing its expanded distribution for all to enjoy.","157","947","Indexable",""
"https://www.beyondmeat.com/en-US/go-beyond-the-buzzer","1","Fuel like the pros with Beyond's Go Beyond the Buzzer cookbook, featuring plant-based meals from NBA stars like Kyrie Irving, Jalen Brunson & Damian Lillard.","157","974","Indexable",""
"https://www.beyondmeat.com/en-CA/faqs","1","Explore our FAQs to find answers to common questions about Beyond's plant-based products, ingredients, and sustainability.","122","774","Indexable",""
"https://www.beyondmeat.com/en-CA/recipes/beyond-beef-mediterranean-skewers","1","Elevate your meals with this delicious vegan kebab recipe from Beyond Meat. These plant-based skewers offer a Mediterranean-inspired feast at home.","147","928","Indexable",""
"https://www.beyondmeat.com/en-CA/contact","1","Click here for product inquiries, restaurant & food service inquires, international sales inquires, press inquiries, or to contact our headquarters or plant.","157","920","Indexable",""
"https://www.beyondmeat.com/en-CA/buy/","1","Ready to buy plant-based protein from Beyond? Find our products on restaurant menus, in grocery stores, or shop online using our store locator.","143","890","Indexable",""
"https://www.beyondmeat.com/en-CA/about/our-ingredients/","1","Ingredients. Plants based meat","30","193","Indexable",""
"https://www.beyondmeat.com/en-CA/about/our-ingredients","1","Ingredients. Plants based meat","30","193","Indexable",""
"https://www.beyondmeat.com/en-CA/recipes/","1","","0","0","Indexable",""
"https://www.beyondmeat.com/en-CA/recipes","1","","0","0","Indexable",""
"https://www.beyondmeat.com/en-CA/terms-of-use","1","Read Beyond's Terms of Use to understand the terms governing your interactions with our website and services.","109","690","Indexable",""
"https://www.beyondmeat.com/en-CA/newsroom/","1","","0","0","Indexable",""
"https://www.beyondmeat.com/en-CA/","1","Beyond Meat is plant-based, vegan meat that's tasty & better for you and for our planet. Find us in the meat aisle or subscribe for Beyond Meat delivery.","153","931","Indexable",""
"https://www.beyondmeat.com/en-CA/products","1","From breakfast sausages to burgers & brats, our Plant-Based products leave you feeling satisfied. Stock up in the meat aisle & head for the nearest cookout!","156","962","Indexable",""
"https://www.beyondmeat.com/en-CA/privacy-policy","1","Discover Beyond's Privacy Policy, outlining our commitment to protecting your data and privacy.","95","592","Indexable",""
"https://www.beyondmeat.com/en-CA/food-service","1","","0","0","Indexable",""
"https://www.beyondmeat.com/en-CA/mission","1","Discover Beyond’s mission to advance clean plant-based protein and build a better food system through nutritious, sustainable plant protein sources.","148","919","Indexable",""
"https://www.beyondmeat.com/en-CA/food-service/sell-beyond-chicken-patties","1","","0","0","Indexable",""
"https://www.beyondmeat.com/en-CA/food-service/sell-beyond-pepperoni","1","","0","0","Indexable",""
"https://www.beyondmeat.com/en-CA/food-service/sell-beyond-burger","1","Partner with Beyond to serve the iconic Beyond Burger on your menu. A plant-based burger ideal for restaurants, chefs, and foodservice operators.","145","903","Indexable",""
"https://www.beyondmeat.com/en-CA/food-service/sell-beyond-sausage","1","Serve plant-based sausage on your menu with Beyond Sausage. Designed for restaurants, sandwiches, pizzas, and breakfast dishes.","127","819","Indexable",""
"https://www.beyondmeat.com/en-CA/food-service/sell-beyond-chicken","1","Partner with Beyond to add plant-based chicken to your menu. Beyond Chicken pieces are versatile for bowls, salads, wraps, and restaurant favorites.","148","922","Indexable",""
"https://www.beyondmeat.com/en-CA/food-service/sell-beyond-beef","1","Partner with Beyond to add plant-based beef to your menu. Beyond Beef is a versatile ground protein for tacos, bowls, and classic dishes for restaurants.","153","942","Indexable",""
"https://www.beyondmeat.com/en-CA/food-service/sell-beyond-breakfast-sausage","1","Serve plant-based breakfast sausage with Beyond. Classic savory patties designed for restaurant menus, breakfast sandwiches, and foodservice operators.","151","962","Indexable",""
"https://www.beyondmeat.com/en-CA/food-service/sell-beyond-steak","1","Partner with Beyond to serve plant-based steak tips on your menu. Beyond Steak is ideal for tacos, bowls, stir-fries, and chef-driven dishes.","141","852","Indexable",""
"https://www.beyondmeat.com/en-CA/whats-new/beyond-chicken-tenders-available-for-the-first-time-at-restaurants-nationwide/","1","","0","0","Indexable",""
"https://www.beyondmeat.com/en-CA/products/the-beyond-burger","1","Beyond burger patties are the iconic vegan patties that put plant based burgers on the map. They're everything a burger should be: delicious & sustainable.","155","950","Indexable",""
"https://www.beyondmeat.com/en-CA/where-to-find?zip=","1","Wondering where to find Beyond products? Check out our guide to locate our plant-based options in stores near you.","114","718","Indexable",""
"https://www.beyondmeat.com/en-CA/whats-new/chris-paul","1","","0","0","Indexable",""
"https://www.beyondmeat.com/en-CA/where-to-find?product=850004207017&search=true","1","Wondering where to find Beyond products? Check out our guide to locate our plant-based options in stores near you.","114","718","Indexable",""
"https://www.beyondmeat.com/en-CA/whats-new/nba-star-kyrie-irving-mentions-his-plant-based-diet-in-latest-nike-commercial","1","","0","0","Indexable",""
"https://www.beyondmeat.com/en-CA/press/liza-koshy-teams-up-with-beyond-meat-and-everfi-to-invite-students-nationwide-to-think-and-live-more-sustainably","1","","0","0","Indexable",""
"https://www.beyondmeat.com/en-CA/products/the-beyond-burger/beyond-burger","1","Beyond burger patties are the iconic vegan patties that put plant based burgers on the map. They're everything a burger should be: delicious & sustainable.","155","950","Indexable",""
"https://www.beyondmeat.com/en-CA/press/beyond-meat-announces-latest-expansion-in-plant-based-chicken-platform","1","","0","0","Indexable",""
"https://www.beyondmeat.com/en-CA/press/pizza-hut-and-beyond-meat-strengthen-partnership-with-debut-of-beyond-italian-sausage-crumbles-at-locations-nationwide","1","","0","0","Indexable",""
"https://www.beyondmeat.com/en-CA/press/the-coffee-bean-and-tea-leaf-beyond-meat","1","","0","0","Indexable",""
"https://www.beyondmeat.com/en-CA/newsroom/images","1","","0","0","Indexable",""
"https://www.beyondmeat.com/en-CA/newsroom/videos","1","","0","0","Indexable",""
"https://www.beyondmeat.com/en-CA/press/panda-express-in-partnership-with-beyond-meat-launches-beyond-the-original-orange-chicken-across-70-locations-nationwide","1","","0","0","Indexable",""
"https://www.beyondmeat.com/en-CA/press/beyond-meat-and-a-and-w-canada-spice-things-up-with-the-launch-of-the-jalapeno-lime-beyond-meat-burger-a-and-w-s-first-all-plant-based-burger-build-canada-version","1","","0","0","Indexable",""
"https://www.beyondmeat.com/en-CA/press?tag=US%20%26%20CANADA&query=","1","","0","0","Indexable",""
"https://www.beyondmeat.com/en-CA/newsroom/fact-sheets","1","","0","0","Indexable",""
"https://www.beyondmeat.com/en-CA/press/beyond-meat-breaks-through-the-breakfast-category-in-canada-by-introducing-plant-based-beyond-breakfast-sausage-links-at-all-major-retailers-across-the-country-","1","","0","0","Indexable",""
"https://www.beyondmeat.com/en-CA/recipes/beyond-breakfast-sausage-tacos","1","Enjoy the taste of our delicious vegan breakfast tacos. This Beyond plant-based twist on a classic breakfast ensures a satisfying & nutritious morning meal.","156","957","Indexable",""
"https://www.beyondmeat.com/en-CA/recipes/snoops-beyond-tailgate-dogg","1","","0","0","Indexable",""
"https://www.beyondmeat.com/en-CA/recipes/beyond-sausage-stuffed-pasta-shells-by-beyond-meat","1","Indulge in Vegan Stuffed Pasta Shells - a flavorful and satisfying vegetarian recipe featuring Beyond Sausage perfect for any pasta lover.","138","841","Indexable",""
"https://www.beyondmeat.com/en-CA/recipes/beyond-beef-stuffed-mushrooms","1","These delicious vegan stuffed mushrooms are filled mushrooms packed with savory herbs & spices. The stuffed mushroom filling is made with Beyond Beef & stems.","158","1013","Indexable",""
"https://www.beyondmeat.com/en-CA/where-to-find?&search=true","1","Wondering where to find Beyond products? Check out our guide to locate our plant-based options in stores near you.","114","718","Indexable",""
"https://www.beyondmeat.com/en-CA/products/beyond-breakfast-sausage/classic-links","1","Our veggie sausage links & spicy vegan breakfast patties are soy, gluten, & GMO free. Use them just like sausage links, or as a substitute for spicy sausage.","157","951","Indexable",""
"https://www.beyondmeat.com/en-CA/where-to-find?&search=true?zip=","1","Wondering where to find Beyond products? Check out our guide to locate our plant-based options in stores near you.","114","718","Indexable",""
"https://www.beyondmeat.com/en-CA/products/beyond-sausage/brat","1","Beyond Sausage is our take on classic brats, hot sausage, & Italian sausage. It's plant-based vegetarian sausage that tastes great & is soy, gluten, & GMO free.","160","977","Indexable",""
"https://www.beyondmeat.com/en-CA/contact/food-service","1","","0","0","Indexable",""
"https://www.beyondmeat.com/en-CA/where-to-find","1","Wondering where to find Beyond products? Check out our guide to locate our plant-based options in stores near you.","114","718","Indexable",""
"https://www.beyondmeat.com/en-CA/products/beyond-beef","1","Looking for a sustainable alternative to ground beef? Beyond Meat's vegan ground beef is your answer- soy, gluten, GMO-free & perfect for your favorite recipes.","160","986","Indexable",""
"https://www.beyondmeat.com/en-CA/contact/international-sales","1","","0","0","Indexable",""
"https://www.beyondmeat.com/en-CA/recipes/beyond-beef-stuffed-butternut-squash","1","Enjoy a comforting vegan meal with our stuffed butternut squash recipe. Beyond's plant-based twist brings a delightful, sustainable flavor to this classic.","155","940","Indexable",""
"https://www.beyondmeat.com/en-CA/recipes/beyond-beef-chipotle-quesadilla","1","Try this delicious vegan quesadilla with Beyond's plant-based beef. Make this guilt-free recipe for a satisfying & nutritious meal, ideal for all foodies.","154","901","Indexable",""
"https://www.beyondmeat.com/en-CA/recipes/beyond-beef-midwest-sloppy-joes","1","Experience the goodness of our vegan sloppy joes. Beyond's plant-based take on this classic dish is filled with flavorful, sustainable ingredients.","147","880","Indexable",""
"https://www.beyondmeat.com/en-US/recipes/beyond-hart-burrito","1","Make NBA star Josh Hart’s go-to burrito with Beyond Steak, sweet potato purée, green rice & spicy mayo. A bold, vegan burrito recipe packed with flavor.","152","940","Indexable",""
"https://www.beyondmeat.com/en-US/recipes/beyond-steak-vietnamese-salad","1","Experience a burst of fresh flavor with vegan Vietnamese noodle salad - a refreshing and nutritious plant-based twist featuring Beyond Steak.","141","870","Indexable",""
"https://www.beyondmeat.com/en-US/whats-new/beyond-steak-wins-the-2023-people-food-awards","1","Beyond Steak receives accolades as the winner of the 2023 People Food Awards, recognized for its exceptional and sustainable plant-based taste.","143","900","Indexable",""
"https://www.beyondmeat.com/en-US/recipes/beyond-steak-tacos?q=Steak","1","Indulge in Vegan Steak Tacos with Beyond Steak - a plant-based twist on classic taco night. Enjoy the taste and texture of steak in a delicious taco.","149","902","Indexable",""
"https://www.beyondmeat.com/en-US/recipes/beyond-steak-chimichurri-and-sweet-potato-plate","1","Savor the flavors of our vegan chimichurri seasoned steak using Beyond Steak, paired with roasted sweet potatoes. A quick, delicious, and plant-based meal!","155","964","Indexable",""
"https://www.beyondmeat.com/en-US/recipes/beyond-philly-cheesesteak?q=Steak","1","Indulge in our tasty vegan Philly cheesesteak sandwich. Use Beyond Steak for a plant-based twist that ensures a quick, guilt-free, and delicious meal.","150","913","Indexable",""
"https://www.beyondmeat.com/en-US/recipes/beyond-steak-and-broccoli-bowl?q=Steak","1","Indulge in Vegan Beef and Broccoli with Beyond Steak - a flavorful version of a classic favorite. A delicious, meat-free option to satisfy your cravings.","153","910","Indexable",""
"https://www.beyondmeat.com/en-US/press/beyond-meat-debuts-the-newest-iteration-of-beyond-sausage-the-1-selling-plant-based-sausage-at-over-15-000-retail-outlets-nationwide","1","Beyond presents the newest iteration of Beyond Sausage, our top-selling plant-based sausage, now found in over 15,000 retail outlets nationwide.","144","899","Indexable",""
"https://www.beyondmeat.com/en-US/whats-new/beyond-steak-named-to-time-s-2022-best-inventions-list","1","Beyond Steak earns a spot on TIME's 2022 Best Inventions List, showcasing its innovative contribution to the world of plant-based eating.","137","849","Indexable",""
"https://www.beyondmeat.com/en-US/recipes/beyond-steak-kbbq-bowl","1","Enjoy this vegan seasoned steak KBBQ Bowl recipe with brown jasmine rice, kimchi, and a flavorful glaze. A delicious plant-based meal ready in under an hour!","157","971","Indexable",""
"https://www.beyondmeat.com/en-US/whats-new/beyond-steak-becomes-the-first-plant-based-meat-to-meet-the-american-diabetes-association-s-better-choices-for-life-nutritional-guidelines","1","Beyond Steak has become the first plant-based meat to meet the American Diabetes Association's nutritional guidelines from the Better Choices for Life program.","159","992","Indexable",""
"https://www.beyondmeat.com/en-US/recipes/beyond-cajun-sausage-scramble?q=sun%20sausage","1","Start your morning with a delicious spicy vegan scramble, featuring Beyond Cajun Sausage and hearty vegetables for a filling, hearty breakfast.","143","881","Indexable",""
"https://www.beyondmeat.com/en-US/serve-love-cookbook","1","Introducing our collection of American Heart Association Heart-Check Certified recipes. Enjoy recipes that not only taste great but are great for your health!","158","954","Indexable",""
"https://www.beyondmeat.com/en-US/press/beyond-meat-debuts-new-product-innovation-beyond-sun-sausage","1","Beyond debuted their new plant-based Sun Sausage, exclusively sold at Sprouts Farmers Market Stores nationwide. Find it in a store near you today!","146","913","Indexable",""
