"https://www.beyondmeat.com/en-US/recipes/beyond-sun-sausage-pesto-penne?q=sun%20sausage","1","Savor a creamy pesto penne pasta with Beyond Sausage, fresh basil pesto, and pasta, creating an Italian-inspired plant-based dish for any occasion.","147","915","Indexable",""
"https://www.beyondmeat.com/en-US/press/beyond-meat-expands-beyond-iv-product-line-with-the-debut-of-new-beyond-sausage","1","Discover our Beyond Sausage with enhanced flavor and nutrition at stores nationwide. Browse the Serve Love cookbook with heart-healthy, AHA-certified recipes.","158","996","Indexable",""
"https://www.beyondmeat.com/en-US/press/beyond-meat-establishes-groundbreaking-plant-based-diet-initiative-at-the-stanford-university-school-of-medicine","1","Beyond initiates a plant-based diet program in partnership with Stanford University School of Medicine, driving the future of plant-based nutrition.","148","895","Indexable",""
"https://www.beyondmeat.com/en-US/recipes/beyond-classic-double-stack-burger","1","Make our mouthwatering vegan cheeseburger recipe in no time. Beyond's plant-based twist offers a quick & satisfying alternative to the classic cheeseburger.","156","969","Indexable",""
"https://www.beyondmeat.com/en-US/recipes/beyond-sausage-risotto","1","Delight in a hearty vegan sausage risotto with Beyond Sausage - a tasty and satisfying option for a plant-based meal that packs a protein punch.","144","891","Indexable",""
"https://www.beyondmeat.com/en-US/recipes/game-day-beyond-sausage-roll-ups-by-beyond-meat","1","Elevate your game day with these flavorful Beyond Sausage Roll-Ups, a vegetarian recipe that's perfect for any fun gathering watching your favorite team.","153","947","Indexable",""
"https://www.beyondmeat.com/en-US/recipes/beyond-sausage-street-brat","1","Elevate your menu with a Beef Brat Recipe featuring Beyond Sausage - a delightful and meat-free take on the classic hearty bratwurst.","133","825","Indexable",""
"https://www.beyondmeat.com/en-US/recipes/beyond-steak-open-faced-sandwich","1","Savor an open-faced sandwich topped with Beyond Steak, crisp veggies, and creamy dressing for a hearty, plant-based lunch or snack option packed with flavor.","157","989","Indexable",""
"https://www.beyondmeat.com/en-US/recipes/beyond-beef-tater-tot-casserole","1","Indulge in the goodness of our vegan tater tot casserole. Beyond's plant-based recipe adds a delightful and eco-friendly twist to this cozy classic.","148","889","Indexable",""
"https://www.beyondmeat.com/en-US/recipes/bobby-calabreses-vegan-marinara-meatballs-with-the-beyond-burger","1","Create a mouthwatering Meatless Meatball Recipe using Beyond Burgers - a delicious and versatile vegan recipe that is perfect for pasta lovers.","143","881","Indexable",""
"https://www.beyondmeat.com/en-US/recipes/beyond-beef-meal-prep-bowl","1","Make your weekly meals easier with this meal prep bowl, packed with Beyond Beef, fresh veggies, and grains for a deliciously balanced plant-based lunch.","152","942","Indexable",""
"https://www.beyondmeat.com/en-US/recipes/beyond-breakfast-sausage-muffins","1","These vegan breakfast muffins are packed with Beyond Breakfast Sausage, making them a tasty, on-the-go option for a flavorful start to your day.","144","903","Indexable",""
"https://www.beyondmeat.com/en-US/recipes/beyond-sausage-air-fryer-pizza-chips","1","Satisfy your cravings with our Air Fryer Pizza Chips recipe, a delightful vegan sausage recipe idea from Beyond. It's crispy, cheesy, and oh-so-delicious.","154","922","Indexable",""
"https://www.beyondmeat.com/en-US/recipes/california-cookout-classic-burger","1","Elevate your outdoor cookout with Vegan Cookout Ideas - try these tasty and creative California Cookout Classic Burger Recipe featuring Beyond Burgers.","151","948","Indexable",""
"https://www.beyondmeat.com/en-US/recipes/beyond-beef-korean-rice-bowl","1","Try our delicious Vegan Korean Beef Rice Bowl, ready in just 15 minutes! Combine Beyond Beef, carrots, and sauce, served over rice for a truly satisfying meal.","159","969","Indexable",""
"https://www.beyondmeat.com/en-US/recipes/bbq-beyond-burger","1","Elevate your next cookout with our delicious BBQ Beyond Burger recipe. It's a delicious vegan option from Beyond, ideal for all grilling enthusiasts.","149","894","Indexable",""
"https://www.beyondmeat.com/en-US/recipes/beyond-beef-ginger-chili-zucchini-noodles","1","Enjoy a hearty vegetarian chili made with Beyond Beef, infused with ginger and zucchini, providing a delicious and warming dish perfect for any occasion.","153","941","Indexable",""
"https://www.beyondmeat.com/en-US/products/beyond-chicken-nuggets/beyond-chicken-nuggets","1","Discover the ultimate vegan chicken nuggets with Beyond. Quick and delicious, these plant-based nuggets are kid approved and ready to enjoy in minutes.","151","946","Indexable",""
"https://www.beyondmeat.com/en-US/recipes/beyond-beef-broccoli-bowl","1","Elevate your next dinner with one of our many vegetarian steak recipes. Pair it with a delicious korean broccoli bowl, providing a balanced and delicious meal.","159","963","Indexable",""
"https://www.beyondmeat.com/en-US/recipes/creamy-beyond-beef-a-roni","1","Indulge in creamy vegan beefaroni with Beyond Beef - a delightful and satisfying plant-based recipe that's perfect for a protein-packed diet.","141","853","Indexable",""
"https://www.beyondmeat.com/en-US/recipes/beyond-gochujang-kimchi-burger","1","Spice up your meal with a Beyond Burger topped with gochujang sauce, kimchi, and fresh veggies for a bold, plant-based take on this Korean-inspired favorite.","157","972","Indexable",""
"https://www.beyondmeat.com/en-US/recipes/beyond-korean-bbq-burger","1","Craft a delectable Korean BBQ burger with Beyond's plant-based goodness. Savor a quick, satisfying, and eco-conscious twist on this unique recipe.","146","909","Indexable",""
"https://www.beyondmeat.com/en-US/recipes/beyond-steak-and-rice-skillet","1","Enjoy a quick vegan steak and rice skillet with Beyond Steak, beans, fresh veggies, and spices for a filling and satisfying plant-based meal in minutes.","152","911","Indexable",""
"https://www.beyondmeat.com/en-US/recipes/beyond-steak-encebollado","1","Savor vegan steak encebollado made with Beyond Steak, tender onions, and savory spices for a plant-based take on Latin flavors, perfect for any meal.","149","929","Indexable",""
"https://www.beyondmeat.com/en-US/recipes/beyond-beef-tacos-2","1","Spice up your next taco night with these delicious vegan tacos made with Beyond Beef. Load them with your favorite fresh toppings for a delicious flavor punch.","159","984","Indexable",""
"https://www.beyondmeat.com/en-US/recipes/beyond-steak-korean-gimbap","1","Roll up bold flavor with this Vegan Steak Korean Gimbap recipe. A high-protein, plant-based twist on a classic made with fresh veggies and savory Beyond Steak.","159","988","Indexable",""
"https://www.beyondmeat.com/en-US/recipes/beyond-steak-creamy-chimichurri-bowl","1","This bowl combines Beyond Steak with vibrant chimichurri sauce and fresh vegetables, offering a flavorful and satisfying vegetarian meal option.","144","892","Indexable",""
"https://www.beyondmeat.com/en-US/recipes/beyond-steak-sopes","1","Savor this vegan sopes recipe topped with Beyond Steak, refried beans, fresh salsa, and zesty toppings—a flavorful, plant-based twist on Mexican street food.","157","970","Indexable",""
"https://www.beyondmeat.com/en-US/recipes/beyond-burger-meatloaf-by-the-yummy-vegan","1","Experience the taste of our delightful vegan meatloaf recipe using our plant-based Beyond Ground Beef, offering a delicious and sustainable vegan twist.","152","939","Indexable",""
"https://www.beyondmeat.com/en-US/recipes/beyond-steak-and-veggie-skillet","1","Savor a vegan steak and veggie skillet with Beyond Steak, colorful vegetables, and savory seasoning—a simple yet delicious plant-based weeknight dish.","150","934","Indexable",""
"https://www.beyondmeat.com/en-US/recipes/beyond-beef-stuffed-mushrooms","1","These delicious vegan stuffed mushrooms are filled mushrooms packed with savory herbs & spices. The stuffed mushroom filling is made with Beyond Beef & stems.","158","1013","Indexable",""
"https://www.beyondmeat.com/en-US/recipes/beyond-cheesy-breakfast-burrito","1","Savor this vegan breakfast burrito filled with Beyond Sausage, melted cheese, and veggies for a delicious plant-based treat to start to your day.","145","879","Indexable",""
"https://www.beyondmeat.com/en-US/recipes/beyond-steak-thai-red-curry","1","Delight in a Vegan Red Curry Recipe with Beyond Steak - a plant-based twist on a classic Thai curry for a delicious meal full of flavor and protein.","148","883","Indexable",""
"https://www.beyondmeat.com/en-US/products/beyond-meatballs","1","Treat yourself to the flavors of Beyond's delicious vegetarian meatballs. Elevate your favorite dishes with these delicious, plant-based alternatives.","150","897","Indexable",""
"https://www.beyondmeat.com/en-US/recipes/beyond-schnitzel-poke","1","Enjoy gyros with only plant based ingredients but the wholesome taste you love with Beyond Meatballs, fresh veggies, and flatbread.","131","815","Indexable",""
"https://www.beyondmeat.com/en-US/recipes/beyond-steak-bake","1","Explore the versatility of Beyond Steak in this Vegan Steak Recipe - a delicious and meat-free twist for all your culinary creations and cooking adventures.","156","938","Indexable",""
"https://www.beyondmeat.com/en-US/recipes/beyond-beef-7-layer-dip","1","Dive into our ultimate vegan 7 layer dip recipe. Explore a world of flavor with Beyond's delectable vegetarian recipes, perfect for your next gathering.","152","905","Indexable",""
"https://www.beyondmeat.com/en-US/recipes/ww-beyond-beef-kofta-and-vegetable-kebabs","1","Savor the delectable flavors of Vegan Beyond Beef Kofta Kebabs: A plant-based twist on a classic, these kebabs are packed with spices and satisfaction.","151","939","Indexable",""
"https://www.beyondmeat.com/en-US/recipes/spaghetti-beyond-meatballs","1","Indulge in the ultimate comfort food with our Vegetarian Spaghetti and Meatballs recipe. A delicious twist on a classic that's meat-free but full of flavor.","156","929","Indexable",""
"https://www.beyondmeat.com/en-US/recipes/beyond-meatballs-spaghetti-squash","1","Prepare a delicious vegan spaghetti squash dish in no time. Enjoy Beyond's plant-based offering, adding a tasty, satisfying, and eco-conscious touch to this classic.","165","1004","Indexable",""
"https://www.beyondmeat.com/en-US/recipes/beyond-sausage-spaghetti-squash-casserole","1","Try a mouthwatering Vegan Spaghetti Squash Casserole with Beyond Sausage - a delicious and nutritious plant-based twist on classic comfort food.","144","916","Indexable",""
"https://www.beyondmeat.com/en-US/recipes/beyond-beef-stuffed-shells-2","1","","0","0","Indexable",""
"https://www.beyondmeat.com/en-US/recipes/beyond-sausage-stuffing","1","Enjoy a delicious Vegan Sausage Stuffing with Beyond Sausage - a savory and plant-based twist on a classic holiday stuffing recipe.","131","812","Indexable",""
"https://www.beyondmeat.com/en-US/recipes/beyond-beef-stuffed-butternut-squash","1","Enjoy a comforting vegan meal with our stuffed butternut squash recipe. Beyond's plant-based twist brings a delightful, sustainable flavor to this classic.","155","940","Indexable",""
"https://www.beyondmeat.com/en-US/recipes/beyond-beef-mapo-tofu","1","Spice up your dinner with this delicious, vegan Mapo Tofu recipe, featuring Beyond Beef, tofu, and savory spices for a satisfying plant-based meal.","147","896","Indexable",""
"https://www.beyondmeat.com/en-US/recipes/beyond-sausage-pesto-pizza","1","Enjoy a delicious and satisfying Vegan Sausage Pizza featuring Beyond Sausage - a mouthwatering and delightful vegetarian pizza option for any pizza lover.","155","970","Indexable",""
"https://www.beyondmeat.com/en-US/recipes/beyond-philly-cheesesteak","1","Indulge in our tasty vegan Philly cheesesteak sandwich. Use Beyond Steak for a plant-based twist that ensures a quick, guilt-free, and delicious meal.","150","913","Indexable",""
"https://www.beyondmeat.com/en-US/recipes/samurai-burger-by-the-wicked-healthy-cookbook-chad-sarno-derek-sarno-and-david-joachim","1","Savor the flavors of this vegan samurai burger recipe featuring Beyond Burger, inspired by The Wicked Healthy Cookbook for a delicious plant-based experience.","158","983","Indexable",""
"https://www.beyondmeat.com/en-US/recipes/beyond-beef-nachos-2","1","Dive into a world of flavor with our delicious vegan nachos recipe. Beyond Meat's twist on classic nachos brings the perfect balance of taste & sustainability.","159","960","Indexable",""
"https://www.beyondmeat.com/en-US/recipes/beyond-beef-midwest-sloppy-joes","1","Experience the goodness of our vegan sloppy joes. Beyond's plant-based take on this classic dish is filled with flavorful, sustainable ingredients.","147","880","Indexable",""
"https://www.beyondmeat.com/en-US/products/beyond-meatballs/italian-style","1","Serve classic Italian flavor with Beyond Meatballs. Plant-based meatballs made for pasta, sandwiches, and your favorite comfort dishes.","135","840","Indexable",""
"https://www.beyondmeat.com/en-US/recipes/beyond-sausage-feta-pasta","1","Explore new and creative vegan sausage ideas with Vegan Sausage Feta Pasta - an elevated plant-based dish that is filling and high in protein.","142","875","Indexable",""
"https://www.beyondmeat.com/en-US/recipes/beyond-elote-burger","1","Whip up a delicious vegan elote burger with ease. Beyond offers a delectable and sustainable vegan option for your classic burger favorite.","139","851","Indexable",""
"https://www.beyondmeat.com/en-US/recipes/beyond-beef-zucchini-boats","1","This recipe showcases Beyond Beef stuffed into zucchini boats, topped with vegan cheese and baked to perfection for a healthy, vegetarian meal option.","150","938","Indexable",""
"https://www.beyondmeat.com/en-US/recipes/beyond-steak-pot-pie","1","Enjoy a comforting vegetarian pot pie featuring Beyond Steak, encased in a flaky crust and filled with savory vegetables and herbs.","131","803","Indexable",""
"https://www.beyondmeat.com/en-US/products/beyond-breakfast-sausage","1","Our veggie sausage links & spicy vegan breakfast patties are soy, gluten, & GMO free. Use them just like sausage links, or as a substitute for spicy sausage.","157","951","Indexable",""
"https://www.beyondmeat.com/en-US/recipes/beyond-breakfast-sausage-tacos","1","Enjoy the taste of our delicious vegan breakfast tacos. This Beyond plant-based twist on a classic breakfast ensures a satisfying & nutritious morning meal.","156","957","Indexable",""
"https://www.beyondmeat.com/en-US/recipes/beyond-steak-chili-crisp-noodles","1","Enjoy our delicious vegan chili crisp noodles recipe with Beyond Steak for a spicy, plant-based meal that’s packed with flavor and perfect for dinner.","150","903","Indexable",""
"https://www.beyondmeat.com/en-US/recipes/beyond-steak-lo-mein","1","Discover the Best Vegan Steak with Beyond Steak Lo Mein - a delightful and satisfying plant-based twist on a classic favorite, perfect for all occasions.","153","923","Indexable",""
"https://www.beyondmeat.com/en-US/recipes/tuscan-style-beyond-sausage-pasta","1","Savor the taste of Tuscany with our Vegan Beyond Sausage Pasta: A plant-based twist on a classic, rich in flavors and Italian charm. Try it today!","146","893","Indexable",""
"https://www.beyondmeat.com/en-US/products/beyond-sun-sausage/pesto","1","Enjoy the savory Pesto Beyond Sun Sausage, a mouth-watering bratwurst made with avocado oil. This vegan sausage is made with no soy, GMOs, or gluten.","149","964","Indexable",""
"https://www.beyondmeat.com/en-US/recipes/beyond-sausage-pasta-salad","1","Enjoy a flavorful vegan pasta salad with Beyond Sausage, fresh veggies, and herbs, perfect for a quick and satisfying plant-based meal.","135","833","Indexable",""
"https://www.beyondmeat.com/en-US/recipes/broccoli-stem-pesto-pasta","1","Enjoy a zero-waste vegan broccoli stem pesto pasta made with Beyond Meat, combining fresh pesto sauce and pasta for a sustainable, plant-based meal.","148","948","Indexable",""
"https://www.beyondmeat.com/en-US/recipes/beyond-sausage-peppers-and-onions","1","Enjoy our vegan sausage peppers & onions recipe, a quick and tasty vegan sandwich option. Ready in 30 minutes, this dish serves 4 and is bursting with flavor.","158","976","Indexable",""
"https://www.beyondmeat.com/en-US/recipes/beyond-steak-korean-bbq-rice-bowl","1","Savor our recipe for this vegan Steak Korean BBQ Rice Bowl with sautéed veggies and spicy gochujang sauce. A vibrant, plant-based meal packed with flavor!","154","969","Indexable",""
"https://www.beyondmeat.com/en-US/recipes/green-goddess-beyond-burger-bowl","1","Enjoy a refreshing Vegan Green Goddess Burger Bowl with all the classic burger flavors in a light, satisfying salad. Perfect for a quick lunch or dinner!","153","914","Indexable",""
"https://www.beyondmeat.com/en-US/recipes/beyond-sun-sausage-pesto-penne","1","Savor a creamy pesto penne pasta with Beyond Sausage, fresh basil pesto, and pasta, creating an Italian-inspired plant-based dish for any occasion.","147","915","Indexable",""
"https://www.beyondmeat.com/en-US/recipes/beyond-hawaiian-bbq-sun-sausage-bowl","1","Enjoy a taste of the islands with Beyond Sun Sausage, pineapple, and tangy BBQ sauce in this vegan Hawaiian bowl bursting with bold flavors.","140","877","Indexable",""
"https://www.beyondmeat.com/en-US/products/beyond-sun-sausage/cajun","1","Spice up your day with our juicy Cajun Beyond Sun Sausage. This vegan sausage is made with avocado oil and flavors that are perfect for cajun-style recipes.","156","966","Indexable",""
"https://www.beyondmeat.com/en-US/recipes/beyond-sausage-mexican-street-corn-brat?q=Sausage","1","Savor the flavors of Vegan Street Corn with Beyond Sausage - a tasty and delightful vegetarian take on the classic and beloved street food favorite.","148","905","Indexable",""
"https://www.beyondmeat.com/en-US/recipes/beyond-steak-kbbq-bao","1","Enjoy this Korean BBQ seasoned steak bao buns recipe made with Beyond Steak, spicy cucumber slaw, and gochujang aioli. A delicious plant-based take on KBBQ!","156","1001","Indexable",""
"https://www.beyondmeat.com/en-US/beyond-health","1","Explore Beyond Health and uncover the goodness of plant-based eating, improving health and sustainability with clean protein options.","133","832","Indexable",""
"https://www.beyondmeat.com/en-US/recipes/no-boil-beyond-sausage-pasta-bake","1","Try our Veggie Sausage Pasta - a flavorful, plant-based, and protein-packed delight with Beyond Sausage. A nutritious addition to your menu.","140","869","Indexable",""
"https://www.beyondmeat.com/en-US/recipes/kimchi-beyond-burger","1","Savor the zing of a vegan kimchi burger - a spicy and satisfying vegetarian recipe with Beyond Beef, perfect for adventurous taste buds.","136","833","Indexable",""
"https://www.beyondmeat.com/en-US/whats-new/the-people-have-spoken-the-beyond-burger-named-best-plant-based-burger-by-people-magazine","1","People Magazine crowns The Beyond Burger as the Best Plant-Based Burger. Discover why it's a people's favorite.","111","700","Indexable",""
"https://www.beyondmeat.com/en-US/recipes/beyond-steak-chimichurri-tacos","1","Spice up taco night with chimichurri seasoned steak tacos made with Beyond Steak. Enjoy bold flavors, fresh ingredients, and a plant-based twist on a classic!","158","972","Indexable",""
"https://www.beyondmeat.com/en-US/whats-new/beyond-chicken-tenders-win-the-2022-people-food-awards","1","Beyond Chicken Tenders are celebrated winners of the 2022 People Food Awards, recognized for their delicious, nutritious plant-based appeal.","140","875","Indexable",""
"https://www.beyondmeat.com/en-US/recipes/burger-caesar-salad","1","Enjoy a guilt-free vegan caesar salad topped with a Beyond Burger - a delicious and protein-packed vegetarian option for a wholesome and balanced meal.","151","949","Indexable",""
"https://www.beyondmeat.com/en-CA/products/beyond-breakfast-sausage?variant=classic-links","1","Our veggie sausage links & spicy vegan breakfast patties are soy, gluten, & GMO free. Use them just like sausage links, or as a substitute for spicy sausage.","157","951","Indexable",""
"https://www.beyondmeat.com/en-CA/products/beyond-sausage/hot-italian-style","1","Beyond Sausage is our take on classic brats, hot sausage, & Italian sausage. It's plant-based vegetarian sausage that tastes great & is soy, gluten, & GMO free.","160","977","Indexable",""
"https://www.beyondmeat.com/en-CA/products/beyond-sausage","1","Beyond Sausage is our take on classic brats, hot sausage, & Italian sausage. It's plant-based vegetarian sausage that tastes great & is soy, gluten, & GMO free.","160","977","Indexable",""
"https://www.beyondmeat.com/en-CA/products/beyond-sausage?variant=mild-italian","1","Beyond Sausage is our take on classic brats, hot sausage, & Italian sausage. It's plant-based vegetarian sausage that tastes great & is soy, gluten, & GMO free.","160","977","Indexable",""
"https://www.beyondmeat.com/en-CA/recipes/beyond-sausage-stuffing","1","Enjoy a delicious Vegan Sausage Stuffing with Beyond Sausage - a savory and plant-based twist on a classic holiday stuffing recipe.","131","812","Indexable",""
"https://www.beyondmeat.com/en-CA/recipes/beyond-sausage-pesto-pizza","1","Enjoy a delicious and satisfying Vegan Sausage Pizza featuring Beyond Sausage - a mouthwatering and delightful vegetarian pizza option for any pizza lover.","155","970","Indexable",""
"https://www.beyondmeat.com/en-CA/recipes/beyond-hawaiian-burger-by-chef-charity-morgan-by-charity-morgan","1","Learn how to make Beyond Hawaiian Burger by Chef Charity Morgan in a few short minutes with these common ingredients.","117","767","Indexable",""
"https://www.beyondmeat.com/en-CA/press/beyond-meat-expands-partnership-with-a-and-w-canada-to-launch-plantbased-chicken-nuggets-nationwide-for-a-limited-time-starting-august-9","1","Beyond has expanded our partnership with A&W Canada to launch plant-based chicken nuggets available nationwide for a limited time starting August 9.","148","944","Indexable",""
"https://www.beyondmeat.com/en-CA/press/pizza-hut-expands-partnership-with-beyond-meat-to-test-new-plant-based-beyond-pepperoni-pizza-topping","1","","0","0","Indexable",""
"https://www.beyondmeat.com/en-CA/press/hopdoddy-burger-bar-goes-beyond-meat-with-new-partnership","1","","0","0","Indexable",""
"https://www.beyondmeat.com/en-CA/recipes/beyond-elote-burger","1","Whip up a delicious vegan elote burger with ease. Beyond offers a delectable and sustainable vegan option for your classic burger favorite.","139","851","Indexable",""
"https://www.beyondmeat.com/en-CA/newsroom","1","","0","0","Indexable",""
"https://www.beyondmeat.com/en-CA/recipes/beyond-burger-meatloaf-by-the-yummy-vegan","1","Experience the taste of our delightful vegan meatloaf recipe using our plant-based Beyond Ground Beef, offering a delicious and sustainable vegan twist.","152","939","Indexable",""
"https://www.beyondmeat.com/en-CA/recipes/beyond-mushroom-bacon-cheeseburger","1","Learn how to make Beyond Mushroom Bacon Cheeseburger in a few short minutes with these common ingredients.","106","713","Indexable",""
"https://www.beyondmeat.com/en-CA/recipes/backyard-bbq-burger","1","Learn how to make Backyard BBQ Burger in a few short minutes with these common ingredients.","91","598","Indexable",""
"https://www.beyondmeat.com/en-US/recipes/beyond-sausage-corn-dog","1","Satisfy your snack cravings with a Vegetarian Corn Dog featuring Beyond Sausage - a tasty and mouthwatering vegan meal for game day or any day.","143","920","Indexable",""
"https://www.beyondmeat.com/en-US/whats-new/debunking-myths-around-processed-foods-a-deeper-science-based-perspective-a-word-from-joy-bauer","1","Registered dietitian Joy Bauer weighs in on the myths about processed foods, and how to tell which ones are beneficial and which are problematic to our health.","159","984","Indexable",""
"https://www.beyondmeat.com/en-US/whats-new/the-truth-about-plant-based-meats-unpacking-the-health-realities-and-navigating-the-nuances-of-ultra-processed-foods","1","Not all processed foods are unhealthy: Learn why Beyond's plant-based products still offer health benefits according to a recent WHO-backed study.","146","912","Indexable",""
"https://www.beyondmeat.com/en-US/whats-new/beyond-burger-iv","1","Discover the fourth generation of Beyond Burger & Beef by Beyond. Made with improved taste, better ingredients, and a cleaner label. Available this Spring!","155","950","Indexable",""
"https://www.beyondmeat.com/en-US/recipes/hot-italian-sausage-flatbread","1","Enjoy this vegan hot Italian sausage flatbread recipe with Beyond Sausage, perfect for a flavorful, plant-based appetizer or main course.","137","837","Indexable",""
"https://www.beyondmeat.com/en-US/recipes/beyond-cajun-sausage-red-beans-and-rice","1","Bring Southern flavors to your kitchen with this Cajun Beyond Sausage Red Beans and Rice recipe. A hearty, plant-based take on a classic Cajun favorite.","152","939","Indexable",""
"https://www.beyondmeat.com/en-US/recipes/beyond-beef-rice-bowl","1","Crafted for heart health, this satisfying, AHA-approved Vegan Beef Rice Bowl features Beyond Beef, brown rice, veggies, and a delicious soy sesame ginger sauce.","160","993","Indexable",""
"https://www.beyondmeat.com/en-US/recipes/beyond-beef-italian-zoodles","1","Try our Italian Beef Vegan Zoodles recipe featuring zucchini and carrot noodles in a savory roasted tomato garlic sauce. Quick, delicious, and heart-healthy!","157","955","Indexable",""
