"Adresse","Occurrences","Meta Description 1","Longueur de la Meta Description 1","Largeur en pixels de la Meta Description 1","Indexabilité","Statut d'indexabilité"
"https://www.beyondmeat.com/en-GB/","1","Beyond Meat is plant-based, vegan meat that's tasty & better for you and for our planet. Find us in the meat aisle or subscribe for Beyond Meat delivery.","153","931","Indexable",""
"https://www.beyondmeat.com/en-GB/buy/","1","Find out how you can get Beyond Meat in the aisles, at the door, or on the menu.","80","493","Indexable",""
"https://www.beyondmeat.com/en-GB/contact","1","Click here for product inquiries, restaurant & food service inquires, international sales inquires, press inquiries, or to contact our headquarters or plant.","157","920","Indexable",""
"https://www.beyondmeat.com/en-GB/mission","1","Learn more about the impacts of shifting from animal to plant-based meat, & how it can have a great impact on our personal health & the health of our planet.","157","972","Indexable",""
"https://www.beyondmeat.com/en-GB/where-to-find?zip=","1","Find Beyond Meat on the menus of restaurants & in the meat aisles of stores near you.","85","532","Indexable",""
"https://www.beyondmeat.com/en-GB/food-service","1","","0","0","Indexable",""
"https://www.beyondmeat.com/en-GB/where-to-find?product=850004207413&search=true","1","Find Beyond Meat on the menus of restaurants & in the meat aisles of stores near you.","85","532","Indexable",""
"https://www.beyondmeat.com/en-GB/privacy-policy","1","Click here to read our privacy policy.","38","221","Indexable",""
"https://www.beyondmeat.com/en-GB/about/our-ingredients","1","Ingredients. Plants based meat","30","193","Indexable",""
"https://www.beyondmeat.com/en-GB/terms-of-use","1","Click here to read our terms of use.","36","214","Indexable",""
"https://www.beyondmeat.com/en-GB/products/the-beyond-burger","1","Beyond Meat burger patties are the iconic plant-based burger patties that put burgers made from plants on the map. They're everything a burger is.","146","905","Indexable",""
"https://www.beyondmeat.com/en-GB/newsroom/","1","","0","0","Indexable",""
"https://www.beyondmeat.com/en-GB/recipes","1","","0","0","Indexable",""
"https://www.beyondmeat.com/en-GB/faqs","1","","0","0","Indexable",""
"https://www.beyondmeat.com/en-GB/recipes/","1","","0","0","Indexable",""
"https://www.beyondmeat.com/en-GB/where-to-find?&search=true","1","Find Beyond Meat on the menus of restaurants & in the meat aisles of stores near you.","85","532","Indexable",""
"https://www.beyondmeat.com/en-GB/whats-new/romelu-lukaku-goes-beyond","1","","0","0","Indexable",""
"https://www.beyondmeat.com/en-GB/products","1","From breakfast sausages to burgers & tenders, our Plant-Based products leave you feeling satisfied. Stock up in the meat aisle & head for the nearest cookout!","158","976","Indexable",""
"https://www.beyondmeat.com/en-GB/products/beyond-meatballs?variant=italian-style","1","Beyond Meat is in a restaurant, meat aisle, or meat store near you. See our Where to Find page for the partner store or restaurant closest to you.","146","885","Indexable",""
"https://www.beyondmeat.com/en-GB/newsroom","1","","0","0","Indexable",""
"https://www.beyondmeat.com/en-GB/products/beyond-sausage?variant=brat-original","1","Beyond Sausage is our take on classic brats, hot sausage, & Italian sausage. It's plant-based vegetarian sausage that tastes great & is soy, gluten, & GMO free.","160","977","Indexable",""
"https://www.beyondmeat.com/en-GB/recipes/lukaku-s-beyond-bangers-and-mash","1","","0","0","Indexable",""
"https://www.beyondmeat.com/en-GB/recipes/null","1","","0","0","Indexable",""
"https://www.beyondmeat.com/en-GB/recipes/oven-baked-beyond-meatballs-in-tomato-and-red-wine-sauce","1","","0","0","Indexable",""
"https://www.beyondmeat.com/en-GB/recipes/smoky-winter-warmer-burger-with-mushroom-and-maple-glazed-squash","1","","0","0","Indexable",""
"https://www.beyondmeat.com/en-GB/recipes/chimichurri-beyond-burger","1","","0","0","Indexable",""
"https://www.beyondmeat.com/en-GB/recipes/5-ingredient-vegan-smoky-mince-and-roasted-pepper-quesadilla","1","","0","0","Indexable",""
"https://www.beyondmeat.com/en-GB/recipes/beyond-la-vie-burger-featured","1","","0","0","Indexable",""
"https://www.beyondmeat.com/en-GB/press/the-coffee-bean-and-tea-leaf-beyond-meat","1","","0","0","Indexable",""
"https://www.beyondmeat.com/en-GB/press/beyond-meat-breaks-through-the-breakfast-category-in-canada-by-introducing-plant-based-beyond-breakfast-sausage-links-at-all-major-retailers-across-the-country-","1","","0","0","Indexable",""
"https://www.beyondmeat.com/en-GB/press/pizza-hut-expands-partnership-with-beyond-meat-to-test-new-plant-based-beyond-pepperoni-pizza-topping","1","","0","0","Indexable",""
"https://www.beyondmeat.com/en-GB/press/panda-express-in-partnership-with-beyond-meat-launches-beyond-the-original-orange-chicken-across-70-locations-nationwide","1","","0","0","Indexable",""
"https://www.beyondmeat.com/en-GB/newsroom/videos","1","","0","0","Indexable",""
"https://www.beyondmeat.com/en-GB/press?tag=US%20%26%20CANADA&query=","1","","0","0","Indexable",""
"https://www.beyondmeat.com/en-GB/press/beyond-meat-announces-latest-expansion-in-plant-based-chicken-platform","1","","0","0","Indexable",""
"https://www.beyondmeat.com/en-GB/newsroom/fact-sheets","1","","0","0","Indexable",""
"https://www.beyondmeat.com/en-GB/newsroom/images","1","","0","0","Indexable",""
"https://www.beyondmeat.com/en-GB/about/our-ingredients/","1","Ingredients. Plants based meat","30","193","Indexable",""
"https://www.beyondmeat.com/en-GB/press/beyond-meat-expands-partnership-with-a-and-w-canada-to-launch-plantbased-chicken-nuggets-nationwide-for-a-limited-time-starting-august-9","1","","0","0","Indexable",""
"https://www.beyondmeat.com/en-GB/recipes/beyond-elote-burger","1","","0","0","Indexable",""
"https://www.beyondmeat.com/en-GB/products/beyond-beef?variant=ground","1","Beyond vegan ground beef is a plant-based ground beef substitute that works in any recipe that calls for ground beef. It's soy, gluten, & GMO free.","147","896","Indexable",""
"https://www.beyondmeat.com/en-GB/products/beyond-sausage/brat","1","Beyond Sausage is our take on classic brats, hot sausage, & Italian sausage. It's plant-based vegetarian sausage that tastes great & is soy, gluten, & GMO free.","160","977","Indexable",""
"https://www.beyondmeat.com/en-GB/products/beyond-beef/ground","1","Beyond vegan ground beef is a plant-based ground beef substitute that works in any recipe that calls for ground beef. It's soy, gluten, & GMO free.","147","896","Indexable",""
"https://www.beyondmeat.com/en-GB/where-to-find","1","Find Beyond Meat on the menus of restaurants & in the meat aisles of stores near you.","85","532","Indexable",""
"https://www.beyondmeat.com/en-GB/products/the-beyond-burger/beyond-burger","1","Beyond Meat burger patties are the iconic plant-based burger patties that put burgers made from plants on the map. They're everything a burger is.","146","905","Indexable",""
"https://www.beyondmeat.com/en-GB/food-service/sell-beyond-meatballs","1","","0","0","Indexable",""
"https://www.beyondmeat.com/en-GB/food-service/sell-beyond-sausage","1","Find more details here on how you can stock Beyond Sausage.","59","385","Indexable",""
"https://www.beyondmeat.com/en-GB/whats-new/pizza-hut-delivery-uk-goes-beyond","1","","0","0","Indexable",""
"https://www.beyondmeat.com/en-GB/food-service/sell-beyond-stack-burger","1","","0","0","Indexable",""
"https://www.beyondmeat.com/en-GB/food-service/sell-beyond-burger","1","Find more details here on how you can stock The Beyond Burger.","62","399","Indexable",""
"https://www.beyondmeat.com/en-GB/food-service/sell-beyond-beef","1","Find more details here on how you can stock Beyond Beef.","56","359","Indexable",""
"https://www.beyondmeat.com/en-GB/contact/international-sales","1","","0","0","Indexable",""
"https://www.beyondmeat.com/en-GB/contact/food-service","1","","0","0","Indexable",""
"https://www.beyondmeat.com/en-GB/where-to-find?&search=true?zip=","1","Find Beyond Meat on the menus of restaurants & in the meat aisles of stores near you.","85","532","Indexable",""
"https://www.beyondmeat.com/en-GB/recipes/beyond-beef-protein-bowl","1","Learn how to make Beyond Beef Buddha Bowls in a few short minutes with these common ingredients.","96","634","Indexable",""
"https://www.beyondmeat.com/en-GB/recipes/pk-subbans-game-day-beyond-beef-tacos","1","Learn how to make P.K. Subbans Game Day Beyond Beef Tacos in a few short minutes with these common ingredients.","111","736","Indexable",""
"https://www.beyondmeat.com/en-GB/recipes/bbq-beyond-burger","1","","0","0","Indexable",""
"https://www.beyondmeat.com/en-GB/recipes/beyond-spring-burger","1","Learn how to make Beyond Spring Burger in a few short minutes with these common ingredients.","92","598","Indexable",""
"https://www.beyondmeat.com/en-GB/recipes/hawaiian-beyond-burger","1","","0","0","Indexable",""
"https://www.beyondmeat.com/en-GB/recipes/beyond-sausage-hot-italian-paella","1","Learn how to make Beyond Meatballs Hero in a few short minutes with these common ingredients.","93","607","Indexable",""
"https://www.beyondmeat.com/en-GB/recipes/gluten-free-butternut-squash-roasted-garlic-italian-sausage-pasta-by-the-vibrant-kitchen","1","Learn how to make Gluten Free Butternut Squash Roasted Garlic Italian Sausage Pasta by The Vibrant Kitchen in a few short minutes with these common ingredients.","160","1023","Indexable",""
"https://www.beyondmeat.com/en-GB/recipes/beyond-sausage-skewers","1","Learn how to make Beyond Sausage Skewers in a few short minutes with these common ingredients.","94","622","Indexable",""
"https://www.beyondmeat.com/en-GB/recipes/spaghetti-beyond-meatballs","1","Learn how to make Spaghetti Beyond Meatballs in a few short minutes with these common ingredients.","98","637","Indexable",""
"https://www.beyondmeat.com/en-GB/where-to-find?product=1230000068239&search=true","1","Find Beyond Meat on the menus of restaurants & in the meat aisles of stores near you.","85","532","Indexable",""
"https://www.beyondmeat.com/en-GB/recipes/beyond-mushroom-bacon-cheeseburger","1","Learn how to make Beyond Mushroom Bacon Cheeseburger in a few short minutes with these common ingredients.","106","713","Indexable",""
"https://www.beyondmeat.com/en-GB/recipes/beyond-beef-mediterranean-skewers","1","Learn how to make Beyond Beef Mediterranean Skewers in a few short minutes with these common ingredients.","105","690","Indexable",""
"https://www.beyondmeat.com/en-GB/press/beyond-meat-launches-beyond-chicken-tenders-at-restaurants-nationwide","1","","0","0","Indexable",""
"https://www.beyondmeat.com/en-GB/press/doordash-and-beyond-meat-introduce-limited-edition-summer-grilling-kits-for-on-demand-delivery","1","","0","0","Indexable",""
"https://www.beyondmeat.com/en-GB/press/hopdoddy-burger-bar-goes-beyond-meat-with-new-partnership","1","","0","0","Indexable",""
"https://www.beyondmeat.com/en-GB/recipes/beyond-mince-keema-with-peas-and-green-beans","1","","0","0","Indexable",""
"https://www.beyondmeat.com/en-GB/products/beyond-beef","1","Beyond vegan ground beef is a plant-based ground beef substitute that works in any recipe that calls for ground beef. It's soy, gluten, & GMO free.","147","896","Indexable",""
"https://www.beyondmeat.com/en-GB/recipes/beyond-mince-burrito-bowls","1","","0","0","Indexable",""
"https://www.beyondmeat.com/en-GB/recipes/guacamole-beyond-burger-by-jeanine-donofrio","1","Learn how to make Guacamole Beyond Burger by Jeanine Donofrio in a few short minutes with these common ingredients.","115","756","Indexable",""
"https://www.beyondmeat.com/en-GB/recipes/juicy-lucy-beyond-burger","1","","0","0","Indexable",""
"https://www.beyondmeat.com/en-GB/recipes/beyond-mince-one-pan-moussaka","1","","0","0","Indexable",""
"https://www.beyondmeat.com/en-GB/products/beyond-meatballs","1","Beyond Meat is in a restaurant, meat aisle, or meat store near you. See our Where to Find page for the partner store or restaurant closest to you.","146","885","Indexable",""
"https://www.beyondmeat.com/en-GB/recipes/beyond-meatballs-pasta-with-pesto","1","Learn how to make Beyond Meatballs Pasta With Pesto in a few short minutes with these common ingredients.","105","684","Indexable",""
"https://www.beyondmeat.com/en-GB/products/beyond-smash","1","","0","0","Indexable",""
"https://www.beyondmeat.com/en-GB/products/beyond-sausage","1","Beyond Sausage is our take on classic brats, hot sausage, & Italian sausage. It's plant-based vegetarian sausage that tastes great & is soy, gluten, & GMO free.","160","977","Indexable",""
"https://www.beyondmeat.com/en-GB/recipes/beyond-sausage-pesto-pizza","1","Learn how to make Beyond Sausage Pesto Pizza in a few short minutes with these common ingredients.","98","643","Indexable",""
"https://www.beyondmeat.com/en-GB/where-to-find?product=1230000147347&search=true","1","Find Beyond Meat on the menus of restaurants & in the meat aisles of stores near you.","85","532","Indexable",""
"https://www.beyondmeat.com/en-GB/where-to-find?product=1230000068536&search=true","1","Find Beyond Meat on the menus of restaurants & in the meat aisles of stores near you.","85","532","Indexable",""
"https://www.beyondmeat.com/en-GB/where-to-find?product=1230000116527&search=true","1","Find Beyond Meat on the menus of restaurants & in the meat aisles of stores near you.","85","532","Indexable",""
"https://www.beyondmeat.com/en-GB/recipes/beyond-schnitzel-poke","1","","0","0","Indexable",""
"https://www.beyondmeat.com/en-GB/recipes/beyond-mince-spaghetti-bolognese","1","","0","0","Indexable",""
"https://www.beyondmeat.com/en-US/where-to-find","1","Wondering where to find Beyond products? Check out our guide to locate our plant-based options in stores near you.","114","718","Indexable",""
"https://www.beyondmeat.com/en-GB/products/beyond-meatballs/italian-style","1","Beyond Meat is in a restaurant, meat aisle, or meat store near you. See our Where to Find page for the partner store or restaurant closest to you.","146","885","Indexable",""
"https://www.beyondmeat.com/en-GB/products/beyond-smash/beyond-smash","1","","0","0","Indexable",""
"https://www.beyondmeat.com/en-US/where-to-find?search=true","1","Wondering where to find Beyond products? Check out our guide to locate our plant-based options in stores near you.","114","718","Indexable",""
"https://www.beyondmeat.com/en-US/press/beyond-meat-launches-beyond-chicken-tenders-at-restaurants-nationwide","1","Beyond launches Chicken Tenders at restaurants, bringing the award-winning plant-based option to tables nationwide. Clean protein, made easy.","141","894","Indexable",""
"https://www.beyondmeat.com/en-US/whats-new/panda-express-goes-beyond","1","Panda Express has launched Beyond Orange Chicken™, a crispy, tangy vegan take on its iconic dish. Discover this plant-based innovation made with Beyond.","152","965","Indexable",""
"https://www.beyondmeat.com/en-GB/recipes/beyond-sausage-stuffing","1","Learn how to make Beyond Sausage Stuffing in a few short minutes with these common ingredients.","95","620","Indexable",""
"https://www.beyondmeat.com/en-US/press/beyond-meat-expands-partnership-with-a-and-w-canada-to-launch-plantbased-chicken-nuggets-nationwide-for-a-limited-time-starting-august-9","1","Beyond has expanded our partnership with A&W Canada to launch plant-based chicken nuggets available nationwide for a limited time starting August 9.","148","944","Indexable",""
"https://www.beyondmeat.com/en-GB/recipes/beyond-beef-chipotle-quesadilla","1","","0","0","Indexable",""
"https://www.beyondmeat.com/en-GB/recipes/beyond-beef-stuffed-butternut-squash","1","Learn how to make Beyond Beef Stuffed Butternut Squash in a few short minutes with these common ingredients.","108","703","Indexable",""
"https://www.beyondmeat.com/en-US/newsroom","1","Stay up to date with the latest news, stories, and announcements from Beyond. Explore our Newsroom for the latest insights into plant-based innovation.","151","945","Indexable",""
"https://www.beyondmeat.com/en-US/recipes","1","Dive into a world of flavor with our diverse collection of vegan meat recipes. Transform your meals with Beyond's delectable plant-based protein offerings.","155","945","Indexable",""
"https://www.beyondmeat.com/en-US/beyondchickennearme","1","Looking for Beyond Chicken near you? Use our store locator to find restaurants and grocery stores offering plant-based chicken from Beyond.","139","873","Indexable",""
"https://www.beyondmeat.com/en-US/newsroom/","1","Stay up to date with the latest news, stories, and announcements from Beyond. Explore our Newsroom for the latest insights into plant-based innovation.","151","945","Indexable",""
"https://www.beyondmeat.com/en-US/about/our-ingredients","1","Discover the plant-based protein sources behind Beyond foods, including peas, lentils, beans, and grains that deliver clean plant protein and balanced nutrition.","161","976","Indexable",""
"https://www.beyondmeat.com/en-US/mission","1","Discover Beyond’s mission to advance clean plant-based protein and build a better food system through nutritious, sustainable plant protein sources.","148","919","Indexable",""
"https://www.beyondmeat.com/en-US/privacy-policy","1","Discover Beyond's Privacy Policy, outlining our commitment to protecting your data and privacy.","95","592","Indexable",""
"https://www.beyondmeat.com/en-US/contact","1","Get in touch with Beyond. We're here to answer your questions and provide information about our plant-based products.","117","741","Indexable",""
"https://www.beyondmeat.com/en-US/terms-of-use","1","Read Beyond's Terms of Use to understand the terms governing your interactions with our website and services.","109","690","Indexable",""
"https://www.beyondmeat.com/en-US/recipes/","1","Dive into a world of flavor with our diverse collection of vegan meat recipes. Transform your meals with Beyond's delectable plant-based protein offerings.","155","945","Indexable",""
"https://www.beyondmeat.com/en-US/food-service","1","Explore Beyond's food service offerings to enhance your menu with delicious plant-based options.","96","601","Indexable",""
"https://www.beyondmeat.com/en-US/products","1","Explore plant-based burgers, sausage, chicken, steak and more from Beyond. Discover clean protein products made to satisfy and designed for your favorite meals.","160","1005","Indexable",""
"https://www.beyondmeat.com/en-US/faqs","1","Explore our FAQs to find answers to common questions about Beyond's plant-based products, ingredients, and sustainability.","122","774","Indexable",""
"https://www.beyondmeat.com/en-US/","1","","0","0","Indexable",""
"https://www.beyondmeat.com/en-US/buy/","1","Ready to buy plant-based protein from Beyond? Find our products on restaurant menus, in grocery stores, or shop online using our store locator.","143","890","Indexable",""
"https://www.beyondmeat.com/en-US/food-service/sell-beyond-burger","1","Partner with Beyond to serve the iconic Beyond Burger on your menu. A plant-based burger ideal for restaurants, chefs, and foodservice operators.","145","903","Indexable",""
"https://www.beyondmeat.com/en-US/food-service/sell-beyond-breakfast-sausage","1","Serve plant-based breakfast sausage with Beyond. Classic savory patties designed for restaurant menus, breakfast sandwiches, and foodservice operators.","151","962","Indexable",""
"https://www.beyondmeat.com/en-US/food-service/sell-beyond-chicken","1","Partner with Beyond to add plant-based chicken to your menu. Beyond Chicken pieces are versatile for bowls, salads, wraps, and restaurant favorites.","148","922","Indexable",""
"https://www.beyondmeat.com/en-US/food-service/sell-beyond-sausage","1","Serve plant-based sausage on your menu with Beyond Sausage. Designed for restaurants, sandwiches, pizzas, and breakfast dishes.","127","819","Indexable",""
"https://www.beyondmeat.com/en-US/contact/food-service","1","Contact us for food service inquiries. We're here to support your needs for plant-based options in the foodservice industry.","124","749","Indexable",""
"https://www.beyondmeat.com/en-US/contact/international-sales","1","Connect with our International Sales team for information on distributing Beyond's plant-based products globally.","113","700","Indexable",""
"https://www.beyondmeat.com/en-US/products/the-beyond-burger/beyond-burger","1","Savor the rich flavor of the Beyond Burger made with avocado oil, delivering a succulent and juicy vegan burger patty that’s low in saturated fat.","146","885","Indexable",""
"https://www.beyondmeat.com/en-US/products/beyond-breakfast-sausage/classic-patties","1","Enjoy a hearty breakfast with our Classic Breakfast Patties, vegan sausage patties crafted to provide a satisfying and delicious start to your day.","147","891","Indexable",""
"https://www.beyondmeat.com/en-US/products/beyond-sausage/hot-italian","1","Get a taste of Italy with our Hot Italian Sausage vegan brats made with avocado oil, bursting with savory spices and a perfect kick for your favorite dishes.","157","949","Indexable",""
"https://www.beyondmeat.com/en-US/recipes-search?q=","1","Search what you're craving and we'll serve up a tasty, plant-based recipe made with Beyond's clean protein products.","116","717","Indexable",""
"https://www.beyondmeat.com/en-US/newsroom/videos","1","Explore our Video Library for a visual journey into the world of Beyond. Watch engaging videos that highlight our plant-based innovations and more.","147","909","Indexable",""
"https://www.beyondmeat.com/en-US/press/beyond-meat-expands-new-line-of-protein-drinks-with-four-additional-flavors","1","Beyond expands the Beyond Immerse clean protein drink line with four new flavors featuring plant-based protein, fiber, and electrolytes for daily nutrition.","156","943","Indexable",""
"https://www.beyondmeat.com/en-US/press/beyond-meat-at-erewhon","1","Beyond is now available at Erewhon! Discover premium vegan chicken, burgers, and steak made with simple ingredients for clean, delicious everyday meals.","152","955","Indexable",""
"https://www.beyondmeat.com/en-US/newsroom/fact-sheets","1","Discover detailed nutrition facts and information about Beyond products. Explore our Fact Sheets for information on our plant-based offerings.","142","881","Indexable",""
"https://www.beyondmeat.com/en-US/press/beyond-meat-expands-distribution-at-walmart","1","Beyond is expanding at Walmart nationwide. Find more plant-based burgers, chicken, and steak options in stores for easier, delicious vegan meal solutions.","154","954","Indexable",""
"https://www.beyondmeat.com/en-US/press/beyond-meat-introduces-new-value-pack-of-its-latest-beyond-beef-at-retailers-across-canada-","1","Beyond introduces a new value pack of Beyond Beef across Canada, expanding access to plant-based protein at major retailers nationwide.","135","860","Indexable",""
"https://www.beyondmeat.com/en-US/press/beyond-meat-teams-up-with-hard-rock-cafe-to-bring-the-latest-beyond-burger-to-fans-nationwide","1","The vegan burger has landed at Hard Rock Cafe! Swap in a Beyond Burger vegan patty on legendary favorites like the Original and Spicy Diablo Smash Burger.","154","972","Indexable",""
"https://www.beyondmeat.com/en-US/press?tag=Us%20%26%20Canada&query=","1","","0","0","Indexable",""
"https://www.beyondmeat.com/en-US/press/beyond-meat-launches-beyond-immerse-protein-drink","1","Beyond launches Beyond Immerse, a clean protein drink featuring plant-based protein, fiber, antioxidants, and electrolytes in a refreshing functional beverage.","159","971","Indexable",""
"https://www.beyondmeat.com/en-US/where-to-find?&search=true?zip=","1","Wondering where to find Beyond products? Check out our guide to locate our plant-based options in stores near you.","114","718","Indexable",""
"https://www.beyondmeat.com/en-US/where-to-find?&modal=true","1","Wondering where to find Beyond products? Check out our guide to locate our plant-based options in stores near you.","114","718","Indexable",""
"https://www.beyondmeat.com/en-US/newsroom/images","1","Browse our Image Library for a collection of high-quality images showcasing Beyond's delicious and sustainable plant-based products.","132","830","Indexable",""
"https://www.beyondmeat.com/en-US/where-to-find?product=850004207093","1","Wondering where to find Beyond products? Check out our guide to locate our plant-based options in stores near you.","114","718","Indexable",""
"https://www.beyondmeat.com/en-US/where-to-find?product=852629004774","1","Wondering where to find Beyond products? Check out our guide to locate our plant-based options in stores near you.","114","718","Indexable",""
"https://www.beyondmeat.com/en-US/where-to-find?product=852629004583","1","Wondering where to find Beyond products? Check out our guide to locate our plant-based options in stores near you.","114","718","Indexable",""
"https://www.beyondmeat.com/en-US/products/beyond-steak","1","Elevate your dining experience with our delectable vegan steak. Beyond's plant-based steak option offers a sustainable and delicious choice for your meals.","155","953","Indexable",""
"https://www.beyondmeat.com/en-US/products/beyond-sausage","1","Beyond Sausage is our take on classic brats, hot sausage, & Italian sausage. It's plant-based vegetarian sausage that tastes great & is soy, gluten, & GMO free.","160","977","Indexable",""
"https://www.beyondmeat.com/en-US/our-impact","1","Learn how Beyond is helping build a more sustainable food system. Explore the environmental impact of plant-based protein and our approach to the future of food.","161","1011","Indexable",""
"https://www.beyondmeat.com/en-US/products/beyond-chicken","1","Turn up the heat with Spicy Buffalo Beyond Chicken pieces, plant-based chicken made with bold buffalo flavor. Crispy, spicy, and perfect for wraps or bowls.","156","960","Indexable",""
