"https://www.beyondmeat.com/en-US/where-to-find?product=810057290831","1","Wondering where to find Beyond products? Check out our guide to locate our plant-based options in stores near you.","114","718","Indexable",""
"https://www.beyondmeat.com/en-US/products/the-beyond-burger","1","Beyond burger patties are the iconic vegan patties that put plant based burgers on the map. They're everything a burger should be: delicious & sustainable.","155","950","Indexable",""
"https://www.beyondmeat.com/en-US/where-to-find?&search=true","1","Wondering where to find Beyond products? Check out our guide to locate our plant-based options in stores near you.","114","718","Indexable",""
"https://www.beyondmeat.com/en-US/food-service/sell-beyond-beef","1","Partner with Beyond to add plant-based beef to your menu. Beyond Beef is a versatile ground protein for tacos, bowls, and classic dishes for restaurants.","153","942","Indexable",""
"https://www.beyondmeat.com/en-US/food-service/sell-beyond-steak","1","Partner with Beyond to serve plant-based steak tips on your menu. Beyond Steak is ideal for tacos, bowls, stir-fries, and chef-driven dishes.","141","852","Indexable",""
"https://www.beyondmeat.com/en-US/food-service/sell-beyond-crispy-nuggets","1","Add plant-based crispy nuggets to your menu with Beyond. Ideal for restaurants, quick-service menus, appetizers, and shareable plates.","134","836","Indexable",""
"https://www.beyondmeat.com/en-US/recipes/beyond-chicken-and-waffle-nuggets","1","Try this delicious vegan chicken nuggets and waffle twist on the classic, a perfect blend of savory and sweet for a brunch treat everyone will enjoy.","149","898","Indexable",""
"https://www.beyondmeat.com/en-US/recipes/beyond-chicken-nugget-tacos","1","Enjoy a quick meal with these vegan chicken nugget tacos, featuring crispy Beyond Chicken Nuggets tossed in enchilada sauce, ranch dressing, and fresh toppings.","160","1005","Indexable",""
"https://www.beyondmeat.com/en-US/recipes/beyond-chicken-nugget-caesar-wrap","1","Enjoy a delicious vegan twist on the classic caesar wrap with Beyond Chicken Nuggets, romaine lettuce, croutons, and your favorite plant-based caesar dressing.","159","990","Indexable",""
"https://www.beyondmeat.com/en-US/recipes/beyond-steak-bulgogi-bowl","1","Enjoy a Korean-inspired vegan bulgogi bowl with Beyond Steak, a delicious sweet and savory sauce, rice, and vegetables for a flavorful plant-based meal.","152","939","Indexable",""
"https://www.beyondmeat.com/en-US/recipes/beyond-steak-avocado-salad","1","Savor a hearty Vegan Steak Salad with Beyond Steak - a mouthwatering and satisfying salad option that's perfect for a balanced vegan meal.","138","870","Indexable",""
"https://www.beyondmeat.com/en-US/recipes/beyond-steak-carne-asada-fries","1","Enjoy our Vegan Carne Asada Fries recipe using Beyond Steak. Savor crispy fries topped with flavorful vegan carne asada – a perfect plant-based indulgence!","155","969","Indexable",""
"https://www.beyondmeat.com/en-US/recipes/beyond-steak-birria-quesa-tacos","1","Enjoy the rich flavors of our vegan Birria tacos recipe made with Beyond Steak. Smothered in homemade Birria sauce and garnished with onions and cilantro.","154","966","Indexable",""
"https://www.beyondmeat.com/en-US/recipes/beyond-steak-quesadilla","1","Enjoy a vegan quesadilla stuffed with Beyond Steak, melty vegan cheese, and fresh veggies, bringing a savory, plant-based twist to a classic favorite.","150","914","Indexable",""
"https://www.beyondmeat.com/en-US/recipes/beyond-steak-california-burrito","1","Enjoy our take on a vegan California burrito packed with Beyond Steak, guacamole, and fresh veggies for a plant-based twist on a fan-favorite recipe.","149","916","Indexable",""
"https://www.beyondmeat.com/en-US/recipes/beyond-beef-korean-egg-rolls","1","Satisfy your cravings with our Korean Vegan Egg Rolls recipe using Beyond Beef. Combine a mix of Korean flavors in crispy, plant-based perfection.","146","905","Indexable",""
"https://www.beyondmeat.com/en-US/recipes/beyond-beef-tan-tan-ramen","1","Enjoy this spicy and flavorful vegan Tan Tan Ramen recipe. Loaded with Beyond Beef and rich broth, it is perfect for a hearty and delicious meal.","145","884","Indexable",""
"https://www.beyondmeat.com/en-US/recipes/beyond-beef-greek-meatball-spanakorizo","1","Savor the taste of the best meatless meatballs. Try this delicious and sustainable Beyond Greek meatball spanakorizo recipe for your next dinner.","145","892","Indexable",""
"https://www.beyondmeat.com/en-US/recipes/beyond-beef-bolognese","1","Learn how to make this delicious vegan bolognese recipe with Beyond, offering a delicious plant-based twist on this classic, heart-warming dish.","144","885","Indexable",""
"https://www.beyondmeat.com/en-US/recipes/beyond-beef-and-hot-italian-lasagna","1","Enjoy a hearty meal with our delicious vegan lasagna recipe. This tasty Beyond recipe offers a sustainable & plant-based twist on classic comfort food.","151","926","Indexable",""
"https://www.beyondmeat.com/en-US/recipes/beyond-beef-picadillo-empanadas","1","Savor these vegan Picadillo Empanadas, filled with spiced Beyond Beef and veggies, making a flavorful, plant-based snack or meal on the go.","139","865","Indexable",""
"https://www.beyondmeat.com/en-US/recipes/beyond-beef-single-serve-meatloaf","1","Satisfy your comfort food cravings with this single-serve vegan meatloaf with Beyond Beef, a plant-based, easy-to-make dish with delicious, comforting flavors.","159","980","Indexable",""
"https://www.beyondmeat.com/en-US/products/beyond-chicken/lemon-herb","1","Bright and savory, Lemon Herb Beyond Chicken Pieces deliver zesty citrus and herb flavor in a vegan chicken option that’s versatile, juicy, and easy to enjoy.","158","956","Indexable",""
"https://www.beyondmeat.com/en-US/recipes/beyond-chicken-broccolini-pesto-pasta","1","This vegan chicken pasta blends tender broccolini, creamy pesto, and Beyond Chicken Pieces for a hearty vegan pesto pasta dish that’s quick and satisfying.","155","963","Indexable",""
"https://www.beyondmeat.com/en-US/products/beyond-chicken/chicken-spicy-buffalo","1","Turn up the heat with Spicy Buffalo Beyond Chicken pieces, plant-based chicken made with bold buffalo flavor. Crispy, spicy, and perfect for wraps or bowls.","156","960","Indexable",""
"https://www.beyondmeat.com/en-US/products/beyond-steak/seasoned-chimichurri","1","Brighten up any meal with Beyond Steak Seasoned with Chimichurri! These delicious, vegan steak tips are protein-packed, pre-seasoned & Heart-Check certified.","157","983","Indexable",""
"https://www.beyondmeat.com/en-US/products/beyond-steak/beyond-steak","1","Elevate your dining experience with our delectable vegan steak. Beyond's plant-based steak option offers a sustainable and delicious choice for your meals.","155","953","Indexable",""
"https://www.beyondmeat.com/en-US/recipes/beyond-steak-taco-salad","1","Create a satisfying Plant-Based Taco Salad with Beyond Steak - a delicious vegan recipe. This hearty salad is perfect for a filling and guilt-free meal.","152","904","Indexable",""
"https://www.beyondmeat.com/en-US/products/beyond-chicken/beyond-chicken-pieces","1","Try our grilled vegan nuggets with 21g protein. Beyond Chicken Pieces are made with avocado oil and clean ingredients for a flavorful plant-based bite.","151","926","Indexable",""
"https://www.beyondmeat.com/en-US/products/beyond-steak/seasoned-korean-bbq-style","1","Savor the bold flavors of Beyond Steak Seasoned Korean BBQ-Style! These flavorful vegan steak tips are pre-seasoned, protein-packed & Heart-Check certified.","156","977","Indexable",""
"https://www.beyondmeat.com/en-US/press/beyond-meat-releases-2023-esg-report-and-lca-study-that-estimates-environmental-benefits-of-beyond-steak","1","Beyond’s 2023 ESG Report and LCA study highlight the environmental benefits of Beyond Steak, including reduced emissions, water use, and land impact.","149","946","Indexable",""
"https://www.beyondmeat.com/en-CA/products/beyond-beef/ground","1","Looking for a sustainable alternative to ground beef? Beyond Meat's vegan ground beef is your answer- soy, gluten, GMO-free & perfect for your favorite recipes.","160","986","Indexable",""
"https://www.beyondmeat.com/en-US/press/beyond-meat-launches-beyond-chicken-pieces-at-kroger-stores-nationwide","1","Beyond Chicken Pieces are now at 1,900+ Kroger stores! Enjoy tasty vegan grilled chicken pieces with 21g of plant protein, avocado oil, and zero cholesterol.","157","960","Indexable",""
"https://www.beyondmeat.com/en-US/press/beyond-meat-unveils-expanded-line-of-steak","1","Beyond expands its Vegan Steak line with two heart-healthy, seasoned steak flavors, Chimichurri and Korean BBQ, offering a delicious plant-based protein.","153","952","Indexable",""
"https://www.beyondmeat.com/en-US/press/beyond-iv-the-fourth-generation-of-the-beyond-burger-and-beyond-beef-debuts-at-grocery-stores-across-the-u-s-including-at-walmart-and-kroger","1","Discover the latest innovation from Beyond: Beyond IV introduces the meatiest, juiciest Beyond Burger & Beef, now available at Walmart, Kroger, and more!","153","951","Indexable",""
"https://www.beyondmeat.com/en-US/whats-new/fueling-an-active-lifestyle-with-plants","1","Fueling an active lifestyle with plants might require a bit more planning, but it absolutely can be done – and your body and the planet will thank you for it!","158","936","Indexable",""
"https://www.beyondmeat.com/en-US/products/beyond-sausage/hot-italian-style","1","Relish the robust flavors of our Original Hot Italian Sausage, delectably spicy plant-based brats that have been crafted for a satisfying and zesty meal.","153","922","Indexable",""
"https://www.beyondmeat.com/en-US/products/beyond-breakfast-sausage?variant=classic","1","Our veggie sausage links & spicy vegan breakfast patties are soy, gluten, & GMO free. Use them just like sausage links, or as a substitute for spicy sausage.","157","951","Indexable",""
"https://www.beyondmeat.com/en-US/products/beyond-sausage/brat","1","Experience the traditional taste of our Original Sausage, flavorful plant-based brats that are perfect for grilling or adding to your favorite hearty recipes.","158","929","Indexable",""
"https://www.beyondmeat.com/en-US/products/beyond-sausage/brat-original","1","Enjoy the classic taste of our Classic Beyond Sausage made with avocado oil, offering a juicy and flavorful experience for a plant-based breakfast or dinner.","157","955","Indexable",""
"https://www.beyondmeat.com/en-US/products/beyond-sausage/sweet-italian","1","Enjoy the delightful flavors of Sweet Italian Sausage, vegan brats that are ideal for use pasta dishes, sandwiches, or grilling with family and friends.","152","903","Indexable",""
"https://www.beyondmeat.com/en-US/products/beyond-breakfast-sausage/classic-links","1","Start your day right with our Classic Breakfast Sausage Links, flavorful vegan breakfast sausages delivering a savory taste that pair perfectly with breakfast favorites.","169","1024","Indexable",""
"https://www.beyondmeat.com/en-US/products/beyond-breakfast-sausage/spicy-patties","1","Turn up the heat at breakfast with our Spicy Breakfast Patties, vegan sausage patties featuring a flavorful blend of spices for a bold morning meal.","148","903","Indexable",""
"https://www.beyondmeat.com/en-US/products/beyond-sausage?variant=brat-original","1","Beyond Sausage is our take on classic brats, hot sausage, & Italian sausage. It's plant-based vegetarian sausage that tastes great & is soy, gluten, & GMO free.","160","977","Indexable",""
"https://www.beyondmeat.com/en-US/recipes/spicy-avocado-beyond-burger","1","Spice up your meal with our AHA-approved Spicy Avocado Beyond Burger recipe! Featuring Beyond Burger patty, jalapeno avocado mayo, heirloom tomato, and arugula.","160","1039","Indexable",""
"https://www.beyondmeat.com/en-US/about/our-ingredients/","1","Discover the plant-based protein sources behind Beyond foods, including peas, lentils, beans, and grains that deliver clean plant protein and balanced nutrition.","161","976","Indexable",""
"https://www.beyondmeat.com/en-US/recipes/beyond-breakfast-sausage-frittata","1","Elevate your breakfast game and make a delicious vegan frittata recipe with Beyond Sausage. Start to the day with a delightful and nutritious plant-based treat.","160","983","Indexable",""
"https://www.beyondmeat.com/en-US/products/beyond-stack-burger/beyond-stack-burger","1","","0","0","Indexable",""
"https://www.beyondmeat.com/en-US/recipes/beyond-italian-sausage-sub-sandwich","1","Savor this hearty vegan Italian sub recipe made with Beyond Sausage, roasted peppers, and marinara sauce for a tasty, plant-based version of the classic.","153","949","Indexable",""
"https://www.beyondmeat.com/en-US/recipes/beyond-sausage-lemon-pasta","1","Indulge in a refreshing vegan lemon pasta dish, featuring Beyond Sausage and bright, citrusy flavors for a delightful and easy-to-make meal.","140","862","Indexable",""
"https://www.beyondmeat.com/en-US/recipes/beyond-sausage-hot-italian-sub","1","Enjoy a delicious Beyond Hot Italian Sausage Sub with caramelized onions, roasted bell peppers, and marinara sauce. Quick to make and bursting with flavor.","155","968","Indexable",""
"https://www.beyondmeat.com/en-US/recipes/beyond-sausage-and-okra-gumbo","1","Warm up with a vegan gumbo featuring Beyond Sausage, fresh okra, and spices for a hearty, plant-based twist on this comforting classic Southern dish.","149","937","Indexable",""
"https://www.beyondmeat.com/en-US/recipes/beyond-sausage-mexican-street-corn-brat","1","Savor the flavors of Vegan Street Corn with Beyond Sausage - a tasty and delightful vegetarian take on the classic and beloved street food favorite.","148","905","Indexable",""
"https://www.beyondmeat.com/en-US/recipes/beyond-sausage-pesto-egg-cups","1","Discover a savory sausage & pesto vegan egg cups recipe featuring our Sweet Italian Beyond Sausage. A plant-based delight for a guilt-free breakfast or brunch.","159","987","Indexable",""
"https://www.beyondmeat.com/en-US/recipes/beyond-sausage-with-caramelized-onion-gravy","1","Try our delicious Beyond Sausage recipe topped with a rich caramelized onion gravy for a savory, plant-based dish perfect for a comforting meal.","144","890","Indexable",""
"https://www.beyondmeat.com/en-US/recipes/beyond-breakfast-sausage-strata","1","Layered with bread, Beyond Sausage, and veggies, this vegan breakfast strata is a delicious and filling dish perfect for your next breakfast or brunch.","151","915","Indexable",""
"https://www.beyondmeat.com/en-US/recipes/beyond-breakfast-sausage-benedict","1","Start your morning with a vegan take on the classic Benedict recipe, topped with Beyond Sausage and an easy hollandaise sauce for a delicious breakfast treat.","158","981","Indexable",""
"https://www.beyondmeat.com/en-US/recipes/the-bang-bang-beyond-burger","1","Spice things up with The Bang Bang Vegan Burger made with Beyond Burger. A plant-based burger packed with bold, spicy flavors—perfect for a kick of heat.","153","967","Indexable",""
"https://www.beyondmeat.com/en-US/recipes/mac-daddy-beyond-stack-burger","1","Indulge in the ultimate comfort food with this Mac Daddy Beyond Stack Burger! Featuring Beyond Stack Burger™ patties topped with creamy, homemade mac and cheese.","161","1048","Indexable",""
"https://www.beyondmeat.com/en-US/recipes/beyond-breakfast-sausage-with-creamy-grits-and-roasted-tomatoes","1","Savor a hearty bowl of vegan grits using Beyond Breakfast Sausage. This plant-based recipe brings a delightful and sustainable option for this warm comfort dish.","161","1000","Indexable",""
"https://www.beyondmeat.com/en-US/recipes/beyond-classic-burger","1","Discover the perfect non-meat burger recipe with Beyond. It's a quick and delicious plant-based alternative to your favorite classic burger.","140","843","Indexable",""
"https://www.beyondmeat.com/en-US/recipes/beyond-patty-melt","1","Looking for a vegan twist on a classic Patty Melt recipe? Try our delicious version made with Beyond Burger, caramelized onions, and awesome sauce on rye bread.","160","1004","Indexable",""
"https://www.beyondmeat.com/en-US/recipes/beyond-burger-bowl","1","Enjoy this delicious vegan burger bowl recipe that offers a delicious twist to a traditional Beyond Burger. Enjoy all your favorite fixings without the bun.","156","924","Indexable",""
"https://www.beyondmeat.com/en-US/recipes/beyond-chicken-fajita-bowl","1","Savor this vegan fajitas recipe with Beyond Chicken Pieces, peppers, rice, and chipotle aioli. A flavorful vegan chicken fajita bowl ready in under 40 minutes.","159","951","Indexable",""
"https://www.beyondmeat.com/en-US/recipes/beyond-steak-bbq-rollup","1","Elevate your meal with Vegan BBQ Steak by Beyond Meat - a smoky, savory, and plant-based delight perfect for barbecue lovers to enjoy.","134","841","Indexable",""
"https://www.beyondmeat.com/en-US/recipes/beyond-chinese-chicken-pieces-salad","1","Make this vegan Chinese chicken salad with Beyond Chicken Pieces, fresh veggies, mandarin, and sesame dressing. A light and crunchy vegan chicken salad favorite.","161","1015","Indexable",""
"https://www.beyondmeat.com/en-US/recipes/beyond-corned-beef-sammy","1","Try this vegan corned beef sandwich made with Beyond Beef, tangy sauerkraut, and spicy mustard on rye for a satisfying, plant-based deli classic.","145","899","Indexable",""
"https://www.beyondmeat.com/en-US/recipes/beyond-beef-empanada","1","Enjoy a plant-based twist on classic empanadas with this easy recipe, filled with seasoned veggies and protein-packed Beyond Beef.","130","811","Indexable",""
"https://www.beyondmeat.com/en-US/recipes/beyond-beef-stuffed-yuca-fritters","1","Enjoy this crispy yuca fritters recipe filled with seasoned Beyond Beef, a perfect vegan appetizer or snack with a delicious vegan twist on this Latin dish.","156","929","Indexable",""
"https://www.beyondmeat.com/en-US/recipes/beyond-sausage-stuffed-pasta-shells-by-beyond-meat","1","Indulge in Vegan Stuffed Pasta Shells - a flavorful and satisfying vegetarian recipe featuring Beyond Sausage perfect for any pasta lover.","138","841","Indexable",""
"https://www.beyondmeat.com/en-US/recipes/beyond-sausage-plantain-empanadas","1","Try vegan plantain empanadas filled with Beyond Sausage and spices for a delicious, plant-based twist on this Latin American classic.","133","824","Indexable",""
"https://www.beyondmeat.com/en-US/recipes/gluten-free-butternut-squash-roasted-garlic-italian-sausage-pasta-by-the-vibrant-kitchen","1","Learn how to make Gluten Free Butternut Squash Roasted Garlic Italian Sausage Pasta by The Vibrant Kitchen in a few short minutes with these common ingredients.","160","1023","Indexable",""
"https://www.beyondmeat.com/en-US/recipes/vegan-lemon-amp-garlic-pasta-with-sausage-by-modern-table","1","Learn how to make Vegan Lemon Amp Garlic Pasta With Sausage by Modern Table in a few short minutes with these common ingredients.","129","854","Indexable",""
"https://www.beyondmeat.com/en-US/recipes/holiday-beef-sliders","1","Elevate your next celebration with Vegetarian Sliders. Featuring Beyond Beef, these delightful Vegan Beef Sliders by Beyond Meat are sure to be a crowd-pleaser.","160","986","Indexable",""
"https://www.beyondmeat.com/en-US/recipes/beyond-sausage-butternut-squash-lasagna-roll-ups","1","Delight in a delicious Vegan Lasagna Recipe with Beyond Sausage - a satisfying and hearty vegetarian twist on a classic Italian favorite.","137","834","Indexable",""
"https://www.beyondmeat.com/en-US/recipes/beyond-beef-greek-nachos","1","Try this fun and delicious Greek nacho recipe for a unique twist on classic nachos. Try this tasty appetizer using Beyond Ground Beef to impress any guest.","155","952","Indexable",""
"https://www.beyondmeat.com/en-US/recipes/beyond-beef-ramen","1","Enjoy a bowl of comforting vegan ramen using Beyond Ground Beef. This Beyond plant-based recipe adds a delightful, nutritious twist to this beloved classic.","156","966","Indexable",""
"https://www.beyondmeat.com/en-US/recipes/sheet-pan-tomato-soup-with-beyond-meatballs","1","Savor the warmth of our Tomato Soup with Beyond's Vegan Meatballs - a hearty, plant-based twist on a classic that's rich in flavor and comfort.","143","885","Indexable",""
"https://www.beyondmeat.com/en-US/recipes/beyond-beef-tortilla-soup","1","Savor the richness of vegan tortilla soup featuring Beyond beef. Bursting with flavor from fire-roasted tomatoes, beans, and spices. A hearty vegan delight!","156","953","Indexable",""
"https://www.beyondmeat.com/en-US/recipes/beyond-beef-italian-meatballs","1","Enjoy the taste of authentic Italian meatballs with our vegan Italian meatballs recipe. Perfectly seasoned, they're a plant-based delight for any pasta dish.","157","941","Indexable",""
"https://www.beyondmeat.com/en-US/recipes/beyond-steak-spicy-miso-ramen","1","Savor the umami flavors of our Vegan Miso Ramen with Beyond Steak - a hearty and plant-based twist on a classic Japanese favorite.","130","825","Indexable",""
"https://www.beyondmeat.com/en-US/recipes/beyond-beef-cabbage-rolls","1","This vegan Cabbage Rolls Recipe offers a plant-based take on a classic dish, stuffed with savory Beyond Beef, seasoned to perfection and ready in 25 minutes.","157","975","Indexable",""
"https://www.beyondmeat.com/en-US/recipes/beyond-brat-breakfast-burrito","1","Start your day with a flavorful vegan breakfast burrito. Beyond's plant-based sausage ensures a satisfying and sustainable way to start your morning right.","155","958","Indexable",""
"https://www.beyondmeat.com/en-US/recipes/beyond-steak-breakfast-burrito","1","Wrap up your morning with a Vegan Breakfast Burrito with Beyond Steak - a flavorful, satisfying, and convenient way to kickstart your day with plant-based goodness.","164","1025","Indexable",""
"https://www.beyondmeat.com/en-US/recipes/beyond-steak-buffalo-breakfast-burrito","1","Try this bold and delicious vegan buffalo breakfast burrito recipe made with Beyond Steak, eggs, and hot sauce for a spicy plant-based start to your day.","153","937","Indexable",""
"https://www.beyondmeat.com/en-US/recipes/beyond-beef-spring-rolls","1","Savor the deliciousness of our vegan spring rolls. Beyond offers a delectable and sustainable vegan recipe, perfect for your spring roll cravings.","146","877","Indexable",""
"https://www.beyondmeat.com/en-US/recipes/beyond-steak-taiwanese-beef-rolls","1","Try Taiwanese-inspired beef rolls made with Beyond Steak, fresh herbs, and savory hoisin sauce—a unique, plant-based twist on a classic Asian snack.","148","924","Indexable",""
"https://www.beyondmeat.com/en-US/recipes/beyond-beef-chipotle-quesadilla","1","Try this delicious vegan quesadilla with Beyond's plant-based beef. Make this guilt-free recipe for a satisfying & nutritious meal, ideal for all foodies.","154","901","Indexable",""
"https://www.beyondmeat.com/en-US/recipes/beyond-quesadilla-pizza","1","Enjoy a fusion of flavors with our vegan quesadilla pizza, made with Beyond, melted cheese, and fresh toppings for a tasty, plant-based treat.","142","868","Indexable",""
"https://www.beyondmeat.com/en-US/recipes/beyond-steak-tacos","1","Indulge in Vegan Steak Tacos with Beyond Steak - a plant-based twist on classic taco night. Enjoy the taste and texture of steak in a delicious taco.","149","902","Indexable",""
"https://www.beyondmeat.com/en-US/recipes/quesadilla-beyond-burger","1","Try this vegan quesadilla burger recipe using Beyond Burger, perfect for a fun, plant-based twist on two delicious classics combined in one dish.","145","881","Indexable",""
"https://www.beyondmeat.com/en-US/recipes/beyond-steak-tacos-with-salsa-verde","1","Enjoy these vegan tacos made with Beyond Steak, topped with zesty salsa verde and fresh, crisp toppings for a satisfying plant-based option for taco night.","155","958","Indexable",""
"https://www.beyondmeat.com/en-US/recipes/beyond-steak-carne-asada-tostada","1","Savor a vegan carne asada tostada with Beyond Steak, refried beans, and fresh toppings for a plant-based take on this crunchy favorite.","135","840","Indexable",""
"https://www.beyondmeat.com/en-US/recipes/beyond-steak-asada-huaraches","1","Try our recipe for vegan steak asada huaraches with Beyond Steak, refried beans, and fresh toppings for a delicious plant-based take on a Mexican classic.","154","952","Indexable",""
"https://www.beyondmeat.com/en-US/recipes/beyond-steak-carne-asada-tortas","1","Savor the flavors of Beyond Steak Carne Asada Tortas, featuring tender Beyond Steak marinated to perfection. Quick and easy to make in just 15 minutes, serves 3.","161","1006","Indexable",""
"https://www.beyondmeat.com/en-US/recipes/beyond-steak-queso","1","Enjoy a delightful Vegetarian Queso Dip featuring Beyond Steak - a cheesy and savory dip that's elevates your appetizer game and is perfect for gatherings.","155","953","Indexable",""
"https://www.beyondmeat.com/en-US/recipes/beyond-rice-burger","1","Try this unique vegan rice burger featuring Beyond, crisp veggies, and a flavorful sauce, all served on crispy rice buns for a tasty twist.","139","820","Indexable",""
"https://www.beyondmeat.com/en-US/recipes/beyond-beef-bulgogi-rice-bowl","1","Enjoy Korean-inspired flavors with this vegan Bulgogi Rice Bowl recipe with Beyond Beef, featuring marinated plant-based protein, crisp veggies, and rice.","154","941","Indexable",""
"https://www.beyondmeat.com/en-US/recipes/beyond-steak-teriyaki-bowl","1","Enjoy a Plant-Based Teriyaki Steak with Beyond Steak - a tasty and vegan teriyaki bowl recipe. Satisfy your cravings with this plant-based twist on a classic.","158","956","Indexable",""
