"Adresse","Occurrences","Meta Description 1","Longueur de la Meta Description 1","Largeur en pixels de la Meta Description 1","Indexabilité","Statut d'indexabilité"
"https://www.wienerschnitzel.com/","1","Wienerschnitzel serving Hot Dog, Chili Cheese-Burgers, Corn Dogs, Chili, Tastee-Freez, and Breakfast. More than 320 quick-serve restaurants in 11 states.","153","941","Indexable",""
"https://www.wienerschnitzel.com/location-results/louisiana/?address=louisiana","1","Wienerschnitzel is one of the leading Hot Dog fast food restaurants in Louisiana. Find the nearest Wienerschnitzel hot dog restaurant to you.","141","864","Non indexable","Canonisé"
"https://www.wienerschnitzel.com/accessibility-statement/","0","","0","0","Indexable",""
"https://www.wienerschnitzel.com/legal-notice/","1","Legal Notice All content of this Internet site is owned or controlled by Galardi Group, Inc. and is protected by worldwide copyright laws.","138","827","Indexable",""
"https://www.wienerschnitzel.com/location-results/arizona/?address=arizona","1","Wienerschnitzel is one of the leading Hot Dog fast food restaurants in Arizona. Find the nearest Wienerschnitzel hot dog restaurant to you.","139","851","Non indexable","Canonisé"
"https://www.wienerschnitzel.com/location-results/new-mexico/?address=nm","1","Wienerschnitzel is one of the leading Hot Dog fast food restaurants in New Mexico. Find the nearest Wienerschnitzel hot dog restaurant to you.","142","878","Non indexable","Canonisé"
"https://www.wienerschnitzel.com/food/hot-dogs/","1","At Wienerschnitzel you have the choice of our hot dogs in Original or 100% All-Beef. Chili Cheese Dog, Kraut Dog, Chicago Dog, Pastrami Dog, Mustard","148","918","Indexable",""
"https://www.wienerschnitzel.com/location-results/california/?address=ca","1","Wienerschnitzel is one of the leading Hot Dog fast food restaurants in California. Find the nearest hot dog restaurant to you.","126","763","Non indexable","Canonisé"
"https://www.wienerschnitzel.com/app/","1","Download the all-new Wienerschnitzel app! Easy ordering, easy delivery and customize your food the way you like it!","115","710","Indexable",""
"https://www.wienerschnitzel.com/location-results/southern-california/?address=newport%20beach%2Cca","1","Wienerschnitzel is one of the leading Hot Dog fast food restaurants in Southern California. Find the nearest Wienerschnitzel hot dog restaurant to you.","151","923","Non indexable","Canonisé"
"https://www.wienerschnitzel.com/comments/","1","Share your comments with Wienerschnitzel about online merchandise, customer service, or restaurant visits — we value your feedback.","131","829","Indexable",""
"https://www.wienerschnitzel.com/food/crowd-pleaser-deals/","1","Crowd Pleasers - Wienerschnitzel","32","204","Indexable",""
"https://www.wienerschnitzel.com/food/fries-snacks/","1","Fries & Snacks - Wienerschnitzel - French Fries, Curly Fries, Jalapeno Poppers, Chili Cheese Fries, Chicken Dippers","115","691","Indexable",""
"https://www.wienerschnitzel.com/location-results/?address=idaho","1","Find a Wienerschnitzel location near you, serving the worlds best Hot Dogs, Chili Cheese Fries, and Tastee Freez Soft Serve. We have over 300 locations.","152","929","Non indexable","Canonisé"
"https://www.wienerschnitzel.com/sitemap/","1","The sitemap for Wienerschnitzel's internet site. Navigate to any page on the website through the sitemap.","105","647","Indexable",""
"https://www.wienerschnitzel.com/grocery/original-corn-dogs/","0","","0","0","Indexable",""
"https://www.wienerschnitzel.com/food/drinks/","1","Drinks - Wienerschnitzel - Coca-Cola, Diet Coke, Sprite, Dr Pepper, Fanta, Barq's Root Beer, Minute Made Lemonade, Southern Lemonade, Iced Tea, Bottled Water","157","982","Indexable",""
"https://www.wienerschnitzel.com/food/breakfast/","1","Breakfast - Wienerschnitzel - Burritos, Biscuit Sandwiches, French Toast, Orange Juice, Chili Cheese Burrito","108","656","Indexable",""
"https://www.wienerschnitzel.com/grocery/chili-cheese-corn-dogs/","0","","0","0","Indexable",""
"https://www.wienerschnitzel.com/drive-thru-life-the-story-of-john-galardi-founder-of-wienerschnitzel/","0","","0","0","Indexable",""
"https://www.wienerschnitzel.com/location-results/texas/?address=tx","1","Wienerschnitzel is one of the leading Hot Dog fast food restaurants in Texas. Find the nearest Wienerschnitzel hot dog restaurant to you.","137","840","Non indexable","Canonisé"
"https://www.wienerschnitzel.com/locations/","1","Locations - Wienerschnitzel. Fast Food Near Me. The World's Largest Hot Dog Chain. 320 Quick-serve restaurants in 11 states. Serving Hot Dogs and Hamburgers","156","995","Indexable",""
"https://www.wienerschnitzel.com/category/news/","1","Get the latest news for Wienerschnitzel - location openings, events, partnerships with the World's Largest Hot Dog Chain","120","737","Non indexable","noindex"
"https://www.wienerschnitzel.com/food/burgers/","1","Burgers - Wienerschnitzel - Hamburgers and Chili Cheeseburgers","62","396","Indexable",""
"https://www.wienerschnitzel.com/food/","1","Explore the full Wienerschnitzel menu, featuring classic hot dogs, corn dogs, chili favorites, burgers, fries, and Tastee Freez treats.","135","794","Indexable",""
"https://www.wienerschnitzel.com/join/","1","Sign up for the Wiener Lovers’ Club to get free food offers, birthday rewards, and exclusive promos delivered straight to your inbox & phone.","141","856","Non indexable","noindex"
"https://www.wienerschnitzel.com/locations-all/","1","Wienerschnitzel's fast food joints and restaurants are present at more than 350 locations. It is an American fast food chain founded in 1961.","141","864","Indexable",""
"https://www.wienerschnitzel.com/privacy-policy/","1","Review the Wienerschnitzel Privacy Policy to understand how we collect, use, and protect your personal information and data.","124","774","Indexable",""
"https://www.wienerschnitzel.com/grocery/","0","","0","0","Indexable",""
"https://www.wienerschnitzel.com/location-results/illinois/?address=il","1","Wienerschnitzel is one of the leading Hot Dog fast food restaurants in Illinois. Find the nearest hot dog restaurant to you.","124","742","Non indexable","Canonisé"
"https://www.wienerschnitzel.com/location-results/store-locations-in-arkansas/","1","Wienerschnitzel is one of the leading Hot Dog fast food restaurants in Texas. Find the nearest Wienerschnitzel hot dog restaurant to you.","137","840","Indexable",""
"https://www.wienerschnitzel.com/locations/wiener-wagon/","1","The Wiener Wagon is a full-service mobile restaurant serving up all our world-famous Wienerschnitzel menu items. Let the Wiener Wagon cater your next event.","156","973","Indexable",""
"https://www.wienerschnitzel.com/location-results/washington/?address=wa","1","Wienerschnitzel is one of the leading Hot Dog fast food restaurants in Washington. Find the nearest Wienerschnitzel hot dog restaurant to you.","142","878","Non indexable","Canonisé"
"https://www.wienerschnitzel.com/location-results/nevada/?address=nv","1","Wienerschnitzel is one of the leading Hot Dog fast food restaurants in Nevada. Find the nearest Wienerschnitzel hot dog restaurant to you.","138","851","Non indexable","Canonisé"
"https://www.wienerschnitzel.com/food/tastee-freez/","1","Tastee-Freez - Wienerschnitzel - Sundaes, Soft Serve Cones, Banana Split, Shakes, Freezees, Mug Root Beer Floats","112","699","Indexable",""
"https://www.wienerschnitzel.com/location-results/colorado/?address=co","1","Wienerschnitzel is one of the leading Hot Dog fast food restaurants in Colorado. Find the nearest hot dog restaurant to you.","124","760","Non indexable","Canonisé"
"https://www.wienerschnitzel.com/location-results/utah/?address=ut","1","Wienerschnitzel is one of the leading Hot Dog fast food restaurants in Utah. Find the nearest Wienerschnitzel hot dog restaurant to you.","136","833","Non indexable","Canonisé"
"https://www.wienerschnitzel.com/about/","1","Learn about Wienerschnitzel’s history, mission, and growth into the world’s largest hot dog chain, dedicated to quality food and service.","137","833","Indexable",""
"https://www.wienerschnitzel.com/food/sandwiches/","1","Sandwiches - Wienerschnitzel - Pastrami and Polish Sandwich","59","381","Indexable",""
"https://www.wienerschnitzel.com/location-results/louisiana/","1","Wienerschnitzel is one of the leading Hot Dog fast food restaurants in Louisiana. Find the nearest Wienerschnitzel hot dog restaurant to you.","141","864","Indexable",""
"https://www.wienerschnitzel.com/location-results/arizona/","1","Wienerschnitzel is one of the leading Hot Dog fast food restaurants in Arizona. Find the nearest Wienerschnitzel hot dog restaurant to you.","139","851","Indexable",""
"https://www.wienerschnitzel.com/location-results/new-mexico/","1","Wienerschnitzel is one of the leading Hot Dog fast food restaurants in New Mexico. Find the nearest Wienerschnitzel hot dog restaurant to you.","142","878","Indexable",""
"https://www.wienerschnitzel.com/food/hot-dogs/mustard-dog/","1","Our Mustard Dog is a grilled original Wienerschnitzel Hot Dog in a fresh, steamed bun topped with tangy French's mustard.","121","752","Indexable",""
"https://www.wienerschnitzel.com/food/hot-dogs/chili-cheese-dog/","1","Chili Cheese Dog is a grilled original Hot Dog in a fresh, steamed bun with a slice of American cheese, topped with Wienerschnitzel's world famous Chili sauce.","159","962","Indexable",""
"https://www.wienerschnitzel.com/food/hot-dogs/green-chile-chili-cheese-dog/","1","Green Chile Chili Cheese Dog is a grilled original Hot Dog in a fresh, steamed bun topped with Wienerschnitzel’s world famous Chili sauce made from a secret recipe, shredded cheddar cheese and Hatch green chiles.","212","1309","Indexable",""
"https://www.wienerschnitzel.com/food/hot-dogs/chicago-veggie-dog/","1","A Veggie Dog in a fresh, steamed bun topped with tomato, chopped onions, pickle spear, relish, sport peppers, yellow mustard and sprinkled with celery salt just like in Chicago!","177","1073","Indexable",""
"https://www.wienerschnitzel.com/food/hot-dogs/bbq-bacon-dog/","1","Grilled World Famous Original Dog in a fresh steamed bun topped with bacon, BBQ sauce, grilled onions and shredded cheddar.","123","782","Indexable",""
"https://www.wienerschnitzel.com/food/hot-dogs/junkyard-dog/","1","The Junkyard Dog has everything but the kitchen sink is served on this Wienerschnitzel favorite! An original grilled Hot Dog is topped with French Fries; world famous Chili sauce; a slice of American cheese; French's mustard and grilled onions all on a hot, steamed bun.","270","1636","Indexable",""
"https://www.wienerschnitzel.com/food/hot-dogs/chili-dog/","1","Our chili dog is a grilled original hot dog in a fresh, steamed bun topped with Wienerschnitzel's world famous chili sauce made from a secret recipe.","149","897","Indexable",""
"https://www.wienerschnitzel.com/food/hot-dogs/corn-dog/","1","Our Corn Dog is a Wienerschnitzel original, a chicken frank is dipped in sweet honey batter and deep fried to perfection!","121","728","Indexable",""
"https://www.wienerschnitzel.com/food/hot-dogs/kraut-dog/","1","Our Kraut Dog is a grilled original Wienerschnitzel Hot Dog in a fresh, steamed bun topped with tangy sauerkraut and French's mustard.","134","832","Indexable",""
"https://www.wienerschnitzel.com/food/hot-dogs/mini-corn-dogs/","1","Mini Corn Dogs, Delicious mini franks dipped in sweet honey corn batter and deep fried to perfection. Available in 6 Pak, 12 Pak and 20 Pak.","140","853","Indexable",""
"https://www.wienerschnitzel.com/food/hot-dogs/chicago-dog/","1","Our Chicago Dog is a grilled original Wienerschnitzel Hot Dog in a hot, steamed bun topped with fresh tomato; fresh onions; pickle spear; relish; sport peppers; tangy French's mustard and sprinkled with celery salt just like in Chicago!","236","1417","Indexable",""
"https://www.wienerschnitzel.com/location-results/california/","1","Wienerschnitzel is one of the leading Hot Dog fast food restaurants in California. Find the nearest hot dog restaurant to you.","126","763","Indexable",""
"https://www.wienerschnitzel.com/location-results/southern-california/","1","Wienerschnitzel is one of the leading Hot Dog fast food restaurants in Southern California. Find the nearest Wienerschnitzel hot dog restaurant to you.","151","923","Indexable",""
"https://www.wienerschnitzel.com/food/crowd-pleaser-deals/two-junkyard-dogs-combo-meal/","1","Two Junkyard Dogs Combo includes two grilled Original Hot Dogs in a fresh, steamed buns topped with French Fries, world-famous Chili sauce, a slice of American cheese, and French's mustard. Includes Small Fries and a Small Soda.","228","1429","Indexable",""
"https://www.wienerschnitzel.com/food/crowd-pleaser-deals/3-chili-dogs-3-corn-dogs-and-3-small-fries-crowd-pleaser-deal/","1","A combo with all of the favorites! 3 World Famous Original Chili Dogs, 3 Corn Dogs and 3 Small Fries.At participating locations.","128","776","Indexable",""
"https://www.wienerschnitzel.com/food/crowd-pleaser-deals/one-chili-cheeseburger-combo-meal/","1","One Chili Cheeseburger Combo includes one Chili Cheeseburger. Quarter-pound hamburger patty topped with chili and American cheese on a soft brioche bun. Includes Small Fries and a Small Soda.","191","1212","Indexable",""
"https://www.wienerschnitzel.com/food/crowd-pleaser-deals/one-deluxe-cheeseburger-combo-meal/","1","One Deluxe Cheeseburger Combo includes one Deluxe Cheeseburger. Quarter-pound hamburger patty topped with American cheese, lettuce, tomato, diced onions, pickles, mayonnaise, ketchup, and mustard on a toasted brioche bun.  Includes Small Fries and a Small Soda.","261","1667","Indexable",""
"https://www.wienerschnitzel.com/food/crowd-pleaser-deals/two-chili-dogs-combo-meal/","1","Two Chili Dog Combo includes two grilled Original Hot Dogs in fresh, steamed buns topped with Wienerschnitzel's world-famous chili sauce made from a secret recipe. Includes Small Fries and a Small Soda.","202","1257","Indexable",""
"https://www.wienerschnitzel.com/food/crowd-pleaser-deals/6-chili-dogs-and-3-medium-fries-crowd-pleaser-deal/","1","Chili Dog fans can't resist this Family Combo! 6 Chili Dogs and 3 Fries.","72","427","Indexable",""
"https://www.wienerschnitzel.com/food/crowd-pleaser-deals/polish-sandwich-combo-meal/","1","Polish Sandwich Combo includes a Polish dog Sandwich, a spicy Polish dog split and placed between two slices of warm rye bread, then topped with Swiss cheese, pickle spear, and French's tangy mustard.  Includes Small Fries and a Small Soda.","240","1498","Indexable",""
"https://www.wienerschnitzel.com/food/crowd-pleaser-deals/two-mustard-dogs-combo-meal/","1","Two Mustard Dogs Combo includes two grilled Original Hot Dogs in a fresh, steamed buns topped with tangy French's mustard. Includes Small Fries and a Small Soda.","161","1023","Indexable",""
"https://www.wienerschnitzel.com/food/crowd-pleaser-deals/two-chicago-dogs-combo-meal/","1","Two Chicago Dogs Combo includes two grilled Original Hot Dogs in a fresh, steamed buns topped with fresh tomato, fresh onions, pickle spear, relish, sport peppers, tangy French's mustard, and sprinkled with celery salt just like in Chicago!. Includes Small Fries and a Small Soda.","280","1706","Indexable",""
"https://www.wienerschnitzel.com/food/crowd-pleaser-deals/two-chili-cheese-dogs-combo-meal/","1","Two Chili Cheese Dogs Combo includes two chili cheese dogs. Includes Small Fries and a Small Soda.","98","618","Indexable",""
"https://www.wienerschnitzel.com/food/crowd-pleaser-deals/4-corn-dogs-4-chili-dogs-4-chili-cheese-fries-crowd-pleaser-deal/","1","A combo with all of the favorites! 4 Corn Dogs, 4 World Famous Original Chili Dogs and 4 Chili Cheese Fries.","108","656","Indexable",""
"https://www.wienerschnitzel.com/food/crowd-pleaser-deals/chicken-tender-two-piece-combo-meal/","1","Chicken Tender Combo includes Chicken Tenders 2 Piece.  Includes Small Fries and a Small Soda.","94","592","Indexable",""
"https://www.wienerschnitzel.com/food/crowd-pleaser-deals/two-corn-dogs-combo-meal/","1","Two Corn Dogs Combo includes two franks dipped in sweet honey batter and deep fried to perfection, Small Fries & Small Soda.","124","782","Indexable",""
"https://www.wienerschnitzel.com/food/crowd-pleaser-deals/two-kraut-dogs-combo-meal/","1","Two Kraut Dog Combo includes two grilled Original Hot Dogs in a fresh, steamed buns topped with tangy sauerkraut and French's mustard. Includes Small Fries and a Small Soda.","173","1096","Indexable",""
"https://www.wienerschnitzel.com/food/crowd-pleaser-deals/two-bbq-bacon-dogs-combo-meal/","1","Two BBQ Bacon Dogs Combo includes two grilled Original Hot Dogs in a fresh, steamed buns topped with bacon, BBQ sauce, grilled onions, and shredded cheddar. Includes Small Fries and a Small Soda.","195","1240","Indexable",""
"https://www.wienerschnitzel.com/food/fries-snacks/jalapeno-poppers/","1","Golden brown poppers stuffed with diced jalapeños and cheddar cheese. Available in 6 Pak, 12 Pak and 20 Pak.","108","686","Indexable",""
"https://www.wienerschnitzel.com/food/fries-snacks/chicken-tenders-two-piece/","1","Chicken Tenders 2 Piece","23","149","Indexable",""
"https://www.wienerschnitzel.com/food/fries-snacks/chili-cheese-fries-burrito/","1","Golden brown French Fries topped with Wienerschnitzel’s world famous, secret recipe Chili and melted shredded cheddar cheese all wrapped in a tortilla.","151","935","Indexable",""
"https://www.wienerschnitzel.com/food/fries-snacks/chili-cheese-fries/","1","Our Chili Cheese Fries are golden brown French Fries topped with Wienerschnitzel's world famous, secret recipe Chili and melted shredded cheddar cheese.","152","948","Indexable",""
"https://www.wienerschnitzel.com/food/fries-snacks/french-fries/","1","Our French Fries are deep fried to a golden brown and salted to perfection.","75","458","Indexable",""
"https://www.wienerschnitzel.com/location-results/","1","Find a Wienerschnitzel location near you, serving the worlds best Hot Dogs, Chili Cheese Fries, and Tastee Freez Soft Serve. We have over 300 locations.","152","929","Indexable",""
"https://www.wienerschnitzel.com/location/181-mchenry-grant-modesto-204-mchenry-modesto-ca-95354/","1","Looking for great hot dogs, corn dogs or chili fries near you? Look no further than Wienerschnitzel fast food near Modesto","122","750","Indexable",""
"https://www.wienerschnitzel.com/location/521-menaul-eubank-albuquerque-9651-menaul-blvd-ne-albuquerque-nm-87112/","1","Find your Wienerschnitzel near Albuquerque, we are a fast food restaurant that specializes in hot dogs, chili dogs, and specialty french fries.","143","858","Indexable",""
"https://www.wienerschnitzel.com/location/464-sunrise-madden-roseville-898-sunrise-avenue-roseville-ca-95661/","1","Find your Wienerschnitzel near Roseville, we are a fast food restaurant that specializes in hot dogs, chili dogs, and specialty french fries.","141","833","Indexable",""
"https://www.wienerschnitzel.com/location/1-pacific-coast-hwy-n-gulf-ave-wilmington-900-w-pacific-coast-hwy-wilmington-ca-90744/","1","Looking for great hot dogs, corn dogs or chili fries near you? Look no further than Wienerschnitzel fast food near Wilmington","125","765","Indexable",""
"https://www.wienerschnitzel.com/food/drinks/sprite/","1","Refreshing and ice cold Sprite®. All soft drinks come in a 20 oz, 30 oz, and 40 oz.","83","494","Indexable",""
"https://www.wienerschnitzel.com/location/768-apple-valley-pimlico-apple-valley-12218-apple-valley-road-bld-3-suite-a-apple-valley-ca-92308/","1","Find your Wienerschnitzel near Apple Valley, we are a fast food restaurant that specializes in hot dogs, chili dogs, and specialty french fries.","144","854","Indexable",""
"https://www.wienerschnitzel.com/location/43-east-imperial-duncan-south-gate-5141-east-imperial-hwy-south-gate-ca-90280/","1","Find your Wienerschnitzel near South Gate. Wienerschnitzel fast food offering amazing hot dogs, corn dogs, chili cheese fries and more!","135","833","Indexable",""
"https://www.wienerschnitzel.com/location/146-north-turner-west-lano-hobbs-1321-north-turner-hobbs-nm-88240/","1","Find your Wienerschnitzel near Hobbs. Wienerschnitzel fast food offering amazing hot dogs, corn dogs, chili cheese fries and more!","130","804","Indexable",""
"https://www.wienerschnitzel.com/location/316-north-azusa-west-grondahl-covina-1212-n-azusa-avenue-covina-ca-91722/","1","Looking for great hot dogs, corn dogs or chili fries near you? Look no further than Wienerschnitzel fast food near Covina","121","738","Indexable",""
"https://www.wienerschnitzel.com/location/363-nordhoff-darby-northridge-18420-nordhoff-northridge-ca-91325/","1","Find your Wienerschnitzel near Northridge. Wienerschnitzel fast food offering amazing hot dogs, corn dogs, chili cheese fries and more!","135","830","Indexable",""
"https://www.wienerschnitzel.com/location-results/texas/","1","Wienerschnitzel is one of the leading Hot Dog fast food restaurants in Texas. Find the nearest Wienerschnitzel hot dog restaurant to you.","137","840","Indexable",""
"https://www.wienerschnitzel.com/location/587-yucaipa-2nd-yucaipa-34852-yucaipa-blvd-yucaipa-ca-92399/","1","Find your Wienerschnitzel near Yucaipa. Wienerschnitzel fast food offering amazing hot dogs, corn dogs, chili cheese fries and more!","132","813","Indexable",""
"https://www.wienerschnitzel.com/food/drinks/coca-cola-zero-sugar/","1","Refreshing and ice cold Coca-Cola® Zero Sugar. All soft drinks come in a 20 oz, 30 oz, and 40 oz.","97","593","Indexable",""
"https://www.wienerschnitzel.com/location/192-western-olsen-amarillo-2801-s-western-street-amarillo-tx-79109/","1","Find Quality Hot dogs, chili fries and corn dogs at Wienerschnitzel near Amarillo","81","487","Indexable",""
"https://www.wienerschnitzel.com/location/317-stockton-mcmahon-sacramento-5980-stockton-blvd-sacramento-ca-95824/","1","Find your Wienerschnitzel near Sacramento, we are a fast food restaurant that specializes in hot dogs, chili dogs, and specialty french fries.","142","855","Indexable",""
"https://www.wienerschnitzel.com/location/16-rosecrans-anderson-paramount-8201-east-rosecrans-paramount-ca-90723/","1","Find Quality Hot dogs, chili fries and corn dogs at Wienerschnitzel near Paramount","82","507","Indexable",""
"https://www.wienerschnitzel.com/location/brentwood-dr-whitehouse-dr-in-lufkin-tx/","0","","0","0","Indexable",""
"https://www.wienerschnitzel.com/location/788-collier-central-lake-elsinore-18284-collier-avenue-200-lake-elsinore-ca-92530/","1","Find your Wienerschnitzel near Lake Elsinore. Wienerschnitzel fast food offering amazing hot dogs, corn dogs, chili cheese fries and more!","138","845","Indexable",""
"https://www.wienerschnitzel.com/location/396-ross-east-15th-amarillo-1507-ross-amarillo-tx-79102/","1","Find Quality Hot dogs, chili fries and corn dogs at Wienerschnitzel near Amarillo","81","487","Indexable",""
"https://www.wienerschnitzel.com/location/729-university-78th-lubbock-7615-b-university-avenue-lubbock-tx-79423/","1","Find your Wienerschnitzel near Lubbock. Wienerschnitzel fast food offering amazing hot dogs, corn dogs, chili cheese fries and more!","132","817","Indexable",""
"https://www.wienerschnitzel.com/location/472-east-hatch-richland-modesto-1620-east-hatch-road-modesto-ca-95351/","1","Find your Wienerschnitzel near Modesto, we are a fast food restaurant that specializes in hot dogs, chili dogs, and specialty french fries.","139","834","Indexable",""
"https://www.wienerschnitzel.com/location/156-story-mcguiness-san-jose-2844-story-road-san-jose-ca-95127/","1","Find your Wienerschnitzel near San Jose, we are a fast food restaurant that specializes in hot dogs, chili dogs, and specialty french fries.","140","836","Indexable",""
"https://www.wienerschnitzel.com/location/718-north-rancho-west-cheyenne-las-vegas-3201-north-rancho-drive-las-vegas-nv-89108/","1","Find your Wienerschnitzel near Las Vegas, we are a fast food restaurant that specializes in hot dogs, chili dogs, and specialty french fries.","141","844","Indexable",""
"https://www.wienerschnitzel.com/location/170-south-bascom-fewtrell-campbell-1940-s-bascom-blvd-campbell-ca-95008/","1","Find Quality Hot dogs, chili fries and corn dogs at Wienerschnitzel near Campbell","81","494","Indexable",""
"https://www.wienerschnitzel.com/location/402-west-avenue-k-17th-street-west-lancaster-1714-west-avenue-k-lancaster-ca-93534/","1","Find your Wienerschnitzel near Lancaster. Wienerschnitzel fast food offering amazing hot dogs, corn dogs, chili cheese fries and more!","134","826","Indexable",""
"https://www.wienerschnitzel.com/location/746-north-harrisville-north-street-harrisville-city-450-n-harrisville-road-harrisville-city-ut-84404/","1","Find your Wienerschnitzel near Harrisville City. Wienerschnitzel fast food offering amazing hot dogs, corn dogs, chili cheese fries and more!","141","851","Indexable",""
"https://www.wienerschnitzel.com/location/west-main-st-and-los-cerritos-in-los-lunas/","0","","0","0","Indexable",""
"https://www.wienerschnitzel.com/location/112-beverly-north-concourse-montebello-2501-beverly-blvd-montebello-ca-90640/","1","Find Quality Hot dogs, chili fries and corn dogs at Wienerschnitzel near Montebello","83","505","Indexable",""
"https://www.wienerschnitzel.com/location/376-cabot-la-paz-laguna-hills-25202-cabot-road-laguna-hills-ca-92653/","1","Find Quality Hot dogs, chili fries and corn dogs at Wienerschnitzel near Laguna Hills","85","513","Indexable",""
"https://www.wienerschnitzel.com/location/817-san-sevaine-mission-boulevard-jurupa-valley-10207-san-sevaine-way-jurupa-valley-ca-91752/","1","Find your Wienerschnitzel near Jurupa Valley. Wienerschnitzel fast food offering amazing hot dogs, corn dogs, chili cheese fries and more!","138","848","Indexable",""
